id_komentar,produk_url,username,rating,ulasan,nama_produk,jumlah_kata,panjang_karakter,label_sentimen
80408477470,https://shopee.co.id/FOREBIE-FIGHT-ACNE-MOIST-SERUM-Pelembab-Serum-(2-in-1)-untuk-Wajah-Berjerawat-i.806035446.14392136622?extraParams=%7B%22display_model_id%22%3A410421524133%2C%22model_selection_logic%22%3A3%7D,Anonim,1,"Produk: Barang rusak | Sorry to say, perdana gue beli forebie satuan gini, malah dpt packaging cacat :( biasa beli paketan lgsg 3, tp mau rutinin pake forebie dng abisin per pcs dan nyetok dia krna yg cepet abis ya serum moist nya krna gue pake totolan juga klo lg ada jerawat. Yg bikin nyesek produknya ampe tumpah😓 giliran isinya udh mau abis dan coba buka malah gabisa, eh ini yg baru malah begitu tutupnya mau dibuka, kebuka sama pumpnya. Mau pengembalian dana pun udh lewat lama bgt dan kesalahan gue jg sih ga merhatiin lg saking percayanya :(",FOREBIE FIGHT ACNE MOIST SERUM Pelembab Serum (2 in 1) untuk Wajah Berjerawat,99,549,Negatif
16989422782,https://shopee.co.id/FOREBIE-FIGHT-ACNE-MOIST-SERUM-Pelembab-Serum-(2-in-1)-untuk-Wajah-Berjerawat-i.806035446.14392136622?extraParams=%7B%22display_model_id%22%3A410421524133%2C%22model_selection_logic%22%3A3%7D,Anonim,1,"pertama kali make forebie beruntusan&jerawat mulai gada lagi nih, tapi pemakaian 2minggu mulai purging, sempet better tapi engga lama, setelah itu aku mutusin oh mungkin harus habis 2 botol, tapi pemakaian kedua ini malah makin parah jerawat di pipi makin banyak, padahal sebelumnya jerawat di pipi aku ga banyak cuma di kening banyak, tpi sekarang kening udah dikit tpi di pipi kanan kiri banyak bgt, ga recomend si ini malah makin parah gada perubahan wkwkw",FOREBIE FIGHT ACNE MOIST SERUM Pelembab Serum (2 in 1) untuk Wajah Berjerawat,75,459,Negatif
17285726857,https://shopee.co.id/FOREBIE-FIGHT-ACNE-MOIST-SERUM-Pelembab-Serum-(2-in-1)-untuk-Wajah-Berjerawat-i.806035446.14392136622?extraParams=%7B%22display_model_id%22%3A410421524133%2C%22model_selection_logic%22%3A3%7D,Anonim,1,"Mungkin setiap org cok""kan,di aku ga ccok panas gatel jerawat muncul gede""banget awlnya dibagian dagu ga ada tapi skrng malah makin meradang pdhl udh berhnti pemakaian..jadi malah tambah ancur nih mukaa ga sembuh😭😭",FOREBIE FIGHT ACNE MOIST SERUM Pelembab Serum (2 in 1) untuk Wajah Berjerawat,33,214,Negatif
29322971421,https://shopee.co.id/FOREBIE-FIGHT-ACNE-MOIST-SERUM-Pelembab-Serum-(2-in-1)-untuk-Wajah-Berjerawat-i.806035446.14392136622?extraParams=%7B%22display_model_id%22%3A410421524133%2C%22model_selection_logic%22%3A3%7D,Anonim,1,"kaget banget baru semingguan pakai langsung bintik2 semua keluar gatel merah2 , sebelumnya emang karena lagi ada close komedo gara2 susncreen .. kirain purging , cuma anehnya pas setiap pakai bsknya bintik2 keluar lagi.. mana pakai sampai leher 😭 dari muka sampai leher bintik2 gatal 😭😭 bingung banget skrg mau gimana 😭",FOREBIE FIGHT ACNE MOIST SERUM Pelembab Serum (2 in 1) untuk Wajah Berjerawat,52,319,Negatif
15251941065,https://shopee.co.id/FOREBIE-FIGHT-ACNE-MOIST-SERUM-Pelembab-Serum-(2-in-1)-untuk-Wajah-Berjerawat-i.806035446.14392136622?extraParams=%7B%22display_model_id%22%3A410421524133%2C%22model_selection_logic%22%3A3%7D,Anonim,1,"bekas jerawat pie malah jadi bopeng 😢, bopeng kecilku jdi lebih jelas. pie tambah merah, kulit jadi kusam. kacau dah sumpah ga espek 😢. apes",FOREBIE FIGHT ACNE MOIST SERUM Pelembab Serum (2 in 1) untuk Wajah Berjerawat,25,140,Negatif
49838749614,https://shopee.co.id/FOREBIE-FIGHT-ACNE-MOIST-SERUM-Pelembab-Serum-(2-in-1)-untuk-Wajah-Berjerawat-i.806035446.14392136622?extraParams=%7B%22display_model_id%22%3A410421524133%2C%22model_selection_logic%22%3A3%7D,Anonim,1,"Cocok untuk: dikulitku gak cocok | Tekstur: gel | Efek: memburuk | Sorry to say tp di kulitku ini sama sekali ga cocok. Jerawat yg awalnya sedikit dan kecil jadi banyak dan besar , meradang, dll intinya makin parah 😭😭 minggu2 awal kupakai udh kerasa kok tdk mmbaik dan sempat chat seller, tp okeylah sesuai saran , kusabar2 pake smpe 8 minggu tp makin parah ternyta. Skrg udh ak stop. Mudah2 an bs membaik kulitku 🙏",FOREBIE FIGHT ACNE MOIST SERUM Pelembab Serum (2 in 1) untuk Wajah Berjerawat,76,415,Negatif
22663562388,https://shopee.co.id/FOREBIE-FIGHT-ACNE-MOIST-SERUM-Pelembab-Serum-(2-in-1)-untuk-Wajah-Berjerawat-i.806035446.14392136622?extraParams=%7B%22display_model_id%22%3A410421524133%2C%22model_selection_logic%22%3A3%7D,nurraz__,1,"Cocok untuk: wajah aku malah nambah jerawat an gais!😭 | Tekstur: gel | Jujur. Pdhl aku udh nyoba skintest dulu di leher gaada efek apa apa dalam satu minggu.tapi pas aku coba ke wajah pdhl baru dua hari jerawat ku malah nambah banyakkkk dan kemerahan 😭😭. Aku gaakan lanjut lagi, entah itu purging atau apa. Kapok kemakan sama marketing😭",FOREBIE FIGHT ACNE MOIST SERUM Pelembab Serum (2 in 1) untuk Wajah Berjerawat,59,336,Negatif
17135740725,https://shopee.co.id/FOREBIE-FIGHT-ACNE-MOIST-SERUM-Pelembab-Serum-(2-in-1)-untuk-Wajah-Berjerawat-i.806035446.14392136622?extraParams=%7B%22display_model_id%22%3A410421524133%2C%22model_selection_logic%22%3A3%7D,Anonim,1,"gk ngaruh malah nambah jerawatan, buat yang mukanya berminyak dll jangan pake ini malah nambah jerawatan",FOREBIE FIGHT ACNE MOIST SERUM Pelembab Serum (2 in 1) untuk Wajah Berjerawat,16,104,Negatif
19768859463,https://shopee.co.id/FOREBIE-FIGHT-ACNE-MOIST-SERUM-Pelembab-Serum-(2-in-1)-untuk-Wajah-Berjerawat-i.806035446.14392136622?extraParams=%7B%22display_model_id%22%3A410421524133%2C%22model_selection_logic%22%3A3%7D,vnxx10,1,Ternyata kemasan baru nya tidak sesuai dgn isi nya tertulis dikmsan 35 ml nyata ny in kira2 10 ml doang | Kemasan nya ada besar isi nya gongg😭🤣,FOREBIE FIGHT ACNE MOIST SERUM Pelembab Serum (2 in 1) untuk Wajah Berjerawat,28,143,Negatif
34906521300,https://shopee.co.id/FOREBIE-FIGHT-ACNE-MOIST-SERUM-Pelembab-Serum-(2-in-1)-untuk-Wajah-Berjerawat-i.806035446.14392136622?extraParams=%7B%22display_model_id%22%3A410421524133%2C%22model_selection_logic%22%3A3%7D,Anonim,1,"Efek: breakout | BENER2 SAKIT HATI DAN SEDIH BANGET, WAKTU ITU AKU NANYA SAMA HOST LIVE BUAT MUDARIN PIH DI SARANIN MOIST SERUM INI AKU GADA JERAWAT SAMA SEKALI DAN GADA BERUNTUSAN SAMA SEKALI AKU MINTA SARANIN BUAT ILANGIN PIH MALAH D SURUH PKE INI, DAN MUKA KU LANGSUNG BREAKOUT PARAH SAMPE DETIK INI WAKTU ITU AKU SEMPET CHAT ADMIN LEWAT SHOPEE KTNYA AKU HARUSNYA GA CO ITU TAPI CO YG ESSENCE KTNYA CS SUKA ADA MISKOM ANTARA CS SAMA HOST LIVE, AWALNYA KUPIKIR OH YA GAPAPA MASIH BISA DI BENERIN DAN AKU LGSG STOP MAKE DETIK ITU JUGA DAN SAMPE SEKARANG GA BERENTI2 JERAWAT DAN BERUNTUSAN BANGET MUKA KU DEMI APAPUN SAKIT HATI BANGET GAPERNAH RUSAK KAYAK BEGINI DAN CS CUMAN MINTA MAAF KARNA MISKOM DAN SALAH KASIH SARAN YG MUNGKIN BAGI MEREKA BIASA AJA TAPI DI AKU FATAL KRNA RUSAK MUKA KU, GILA DISINI AKU SAKIT HATI BANGET GAAKAN KU MAAFIN KAMU YA FOREBIE",FOREBIE FIGHT ACNE MOIST SERUM Pelembab Serum (2 in 1) untuk Wajah Berjerawat,156,859,Negatif
17252828977,https://shopee.co.id/FOREBIE-FIGHT-ACNE-MOIST-SERUM-Pelembab-Serum-(2-in-1)-untuk-Wajah-Berjerawat-i.806035446.14392136622?extraParams=%7B%22display_model_id%22%3A410421524133%2C%22model_selection_logic%22%3A3%7D,gazza.,1,"Cocok untuk: kulit yang tidak badak | Tekstur: terlalu kental | Ihh overclaim, padahal sudah beraharap 2%SA 5%Niacinamide",FOREBIE FIGHT ACNE MOIST SERUM Pelembab Serum (2 in 1) untuk Wajah Berjerawat,18,121,Negatif
17034377211,https://shopee.co.id/FOREBIE-FIGHT-ACNE-MOIST-SERUM-Pelembab-Serum-(2-in-1)-untuk-Wajah-Berjerawat-i.806035446.14392136622?extraParams=%7B%22display_model_id%22%3A410421524133%2C%22model_selection_logic%22%3A3%7D,s2r1n2h,1,Cocok untuk: kulit berminyak | Tekstur: sesuai | Efek: bagus,FOREBIE FIGHT ACNE MOIST SERUM Pelembab Serum (2 in 1) untuk Wajah Berjerawat,10,60,Negatif
77830580889,https://shopee.co.id/FOREBIE-FIGHT-ACNE-MOIST-SERUM-Pelembab-Serum-(2-in-1)-untuk-Wajah-Berjerawat-i.806035446.14392136622?extraParams=%7B%22display_model_id%22%3A410421524133%2C%22model_selection_logic%22%3A3%7D,Anonim,1,"Beneran, semua skincare cocok cocokan, masa purging Salisilic acid normalnya 4-8 minggu sayangnya di aku udah hampir 4 bulanan gx membaik malah makin parah  jerawatnya, setelah aku stop malah membaik",FOREBIE FIGHT ACNE MOIST SERUM Pelembab Serum (2 in 1) untuk Wajah Berjerawat,30,199,Negatif
57368943281,https://shopee.co.id/FOREBIE-FIGHT-ACNE-MOIST-SERUM-Pelembab-Serum-(2-in-1)-untuk-Wajah-Berjerawat-i.806035446.14392136622?extraParams=%7B%22display_model_id%22%3A410421524133%2C%22model_selection_logic%22%3A3%7D,Anonim,1,"Barang bagus no minus, uda repurchase kedua kali, tp krn pengiriman lama bgt, seminggu baru sampai jadi aku kasih bintang 1",FOREBIE FIGHT ACNE MOIST SERUM Pelembab Serum (2 in 1) untuk Wajah Berjerawat,21,123,Negatif
94487138678,https://shopee.co.id/FOREBIE-FIGHT-ACNE-MOIST-SERUM-Pelembab-Serum-(2-in-1)-untuk-Wajah-Berjerawat-i.806035446.14392136622?extraParams=%7B%22display_model_id%22%3A410421524133%2C%22model_selection_logic%22%3A3%7D,Anonim,1,Tekstur: JLK | Penghapusan bruntusan: jlk | GA RISPEK GABISA NEGOSIASI GA PUNYA HATI NURANI,FOREBIE FIGHT ACNE MOIST SERUM Pelembab Serum (2 in 1) untuk Wajah Berjerawat,15,91,Negatif
56324914595,https://shopee.co.id/FOREBIE-FIGHT-ACNE-MOIST-SERUM-Pelembab-Serum-(2-in-1)-untuk-Wajah-Berjerawat-i.806035446.14392136622?extraParams=%7B%22display_model_id%22%3A410421524133%2C%22model_selection_logic%22%3A3%7D,Anonim,1,"yang nge live in produk nya judes bgt, padahal cuma nanya doang pertanyaan yg sama karna aku masih belum paham karna ada masalah konesi jaringan. tapi jawab nya judes bgt, padahal sesimpel di jawab wajar atau engga. evaluasi lagi ya ci karyawan live nya, jgn judes judes kalo jualan.",FOREBIE FIGHT ACNE MOIST SERUM Pelembab Serum (2 in 1) untuk Wajah Berjerawat,49,283,Negatif
16431170692,https://shopee.co.id/FOREBIE-FIGHT-ACNE-MOIST-SERUM-Pelembab-Serum-(2-in-1)-untuk-Wajah-Berjerawat-i.806035446.14392136622?extraParams=%7B%22display_model_id%22%3A410421524133%2C%22model_selection_logic%22%3A3%7D,,1,gabisa di cancel _-,FOREBIE FIGHT ACNE MOIST SERUM Pelembab Serum (2 in 1) untuk Wajah Berjerawat,4,19,Negatif
77830590241,https://shopee.co.id/FOREBIE-FIGHT-ACNE-MOIST-SERUM-Pelembab-Serum-(2-in-1)-untuk-Wajah-Berjerawat-i.806035446.14392136622?extraParams=%7B%22display_model_id%22%3A410421524133%2C%22model_selection_logic%22%3A3%7D,Anonim,1,"Semua skincare tergantung kulit masing"". Kalo cocok lanjutin aja, kalo gx cocok stop.",FOREBIE FIGHT ACNE MOIST SERUM Pelembab Serum (2 in 1) untuk Wajah Berjerawat,13,85,Negatif
99086426368,https://shopee.co.id/FOREBIE-FIGHT-ACNE-MOIST-SERUM-Pelembab-Serum-(2-in-1)-untuk-Wajah-Berjerawat-i.806035446.14392136622?extraParams=%7B%22display_model_id%22%3A410421524133%2C%22model_selection_logic%22%3A3%7D,amaliafariza,1,maaf kak aku review jelek. For the first time aku kasi produk bintang 1 karna ini beneran pertama kali nya nyoba produk yg udh 1bulan lebih purgingnya ga ilang-ilang. Bahkan muncul di area pipi dimana aku jarang jerawatan disitu:),FOREBIE FIGHT ACNE MOIST SERUM Pelembab Serum (2 in 1) untuk Wajah Berjerawat,39,230,Negatif
56081432823,https://shopee.co.id/FOREBIE-FIGHT-ACNE-MOIST-SERUM-Pelembab-Serum-(2-in-1)-untuk-Wajah-Berjerawat-i.806035446.14392136622?extraParams=%7B%22display_model_id%22%3A410421524133%2C%22model_selection_logic%22%3A3%7D,c7jfww3pu3,1,"Respon Penjual: | Maaf atas kendalanya kak, jika ada pertanyaan boleh chat minbie ya. Makasih kak💖💖💖",FOREBIE FIGHT ACNE MOIST SERUM Pelembab Serum (2 in 1) untuk Wajah Berjerawat,16,100,Negatif
91036488432,https://shopee.co.id/FOREBIE-FIGHT-ACNE-MOIST-SERUM-Pelembab-Serum-(2-in-1)-untuk-Wajah-Berjerawat-i.806035446.14392136622?extraParams=%7B%22display_model_id%22%3A410421524133%2C%22model_selection_logic%22%3A3%7D,azkahanaya,1,Barang tidak saya terima dan tidak ada pengembalian dana,FOREBIE FIGHT ACNE MOIST SERUM Pelembab Serum (2 in 1) untuk Wajah Berjerawat,9,56,Negatif
81006184180,https://shopee.co.id/FOREBIE-FIGHT-ACNE-MOIST-SERUM-Pelembab-Serum-(2-in-1)-untuk-Wajah-Berjerawat-i.806035446.14392136622?extraParams=%7B%22display_model_id%22%3A410421524133%2C%22model_selection_logic%22%3A3%7D,littleb1tcjh,1,Produk: Barang rusak | Sedih banget barangnya udah nyampe tapi ternyata kebuka kaya gini :( isinya udah tumpah kemana” karena tutupnya kebuka sendiri atau gimana (?) udah nyoba buat ditutup ulang tapi gabisa. Huhu rugi bgt padahal udah nunggu lama 😭,FOREBIE FIGHT ACNE MOIST SERUM Pelembab Serum (2 in 1) untuk Wajah Berjerawat,41,249,Negatif
28811809781,https://shopee.co.id/FOREBIE-FIGHT-ACNE-MOIST-SERUM-Pelembab-Serum-(2-in-1)-untuk-Wajah-Berjerawat-i.806035446.14392136622?extraParams=%7B%22display_model_id%22%3A410421524133%2C%22model_selection_logic%22%3A3%7D,Anonim,1,Respon Penjual: | Kak mohon maaf ada kendala apa ya kak?🥹💖 | Minbie siap membantu💖💖💖,FOREBIE FIGHT ACNE MOIST SERUM Pelembab Serum (2 in 1) untuk Wajah Berjerawat,15,84,Negatif
16193189843,https://shopee.co.id/FOREBIE-FIGHT-ACNE-MOIST-SERUM-Pelembab-Serum-(2-in-1)-untuk-Wajah-Berjerawat-i.806035446.14392136622?extraParams=%7B%22display_model_id%22%3A410421524133%2C%22model_selection_logic%22%3A3%7D,Anonim,2,"Cocok untuk: jerawat | Tekstur: lengket | Efek: oke | Ni tolong deh sapa sih yg desain packaging nya, makin susah makenya, ga travel friendly juga, mending packaging yg lama ini mah, lagian udah tau tekstur serumnya kental malah dibikin gini, banyak yg terbuang klau pump nya udah ga nyampe, tolonglah forebie, kualitas serumnya dah oke bgt, tpi packaging nya ga banget, jdi males beli lagi klau gini mah",FOREBIE FIGHT ACNE MOIST SERUM Pelembab Serum (2 in 1) untuk Wajah Berjerawat,69,404,Negatif
15325829991,https://shopee.co.id/FOREBIE-FIGHT-ACNE-MOIST-SERUM-Pelembab-Serum-(2-in-1)-untuk-Wajah-Berjerawat-i.806035446.14392136622?extraParams=%7B%22display_model_id%22%3A410421524133%2C%22model_selection_logic%22%3A3%7D,auliazahra030,2,Tekstur: kental | Cocok untuk: cocok di aku | Efek: bekas jerawat pudar dan cepat kempes | cocok buat kulit yang cepat tumbuh jerawat,FOREBIE FIGHT ACNE MOIST SERUM Pelembab Serum (2 in 1) untuk Wajah Berjerawat,24,133,Negatif
35208081320,https://shopee.co.id/FOREBIE-FIGHT-ACNE-MOIST-SERUM-Pelembab-Serum-(2-in-1)-untuk-Wajah-Berjerawat-i.806035446.14392136622?extraParams=%7B%22display_model_id%22%3A410421524133%2C%22model_selection_logic%22%3A3%7D,Anonim,2,"Pertama kali beli di officialnya langsung ,maksdnya biar beli produknya yg asli  malah pengiriman sangat sangat sangat buruk.dari produk dikirim tgl 21/3/25 baru kekirim hari ini tgl 1/4/25.nunggu paket sampai 11 hari wowwww bngt deh.mudah’an cuma aku yg mengalami ini ya.",FOREBIE FIGHT ACNE MOIST SERUM Pelembab Serum (2 in 1) untuk Wajah Berjerawat,41,272,Negatif
15275785137,https://shopee.co.id/FOREBIE-FIGHT-ACNE-MOIST-SERUM-Pelembab-Serum-(2-in-1)-untuk-Wajah-Berjerawat-i.806035446.14392136622?extraParams=%7B%22display_model_id%22%3A410421524133%2C%22model_selection_logic%22%3A3%7D,hectorss1310ok,2,Tekstur: bagus | Cocok untuk: tidak cocok di saya makin parah makin merah | Efek: no efek makin parah iya,FOREBIE FIGHT ACNE MOIST SERUM Pelembab Serum (2 in 1) untuk Wajah Berjerawat,20,105,Negatif
40011410805,https://shopee.co.id/FOREBIE-FIGHT-ACNE-MOIST-SERUM-Pelembab-Serum-(2-in-1)-untuk-Wajah-Berjerawat-i.806035446.14392136622?extraParams=%7B%22display_model_id%22%3A410421524133%2C%22model_selection_logic%22%3A3%7D,rahel_2345,2,"Tekstur: gel | Efek: dikulit ku ga cocok :( | pdhl udh berharap bgt sm produk ini, tpi gacocok dan malah memperparah jerawatku, makin banyak jerawat mendem malahan ni, pokonya di pipi di dagu makin banyak. Skincare emg hrs cocok²an🫠💔",FOREBIE FIGHT ACNE MOIST SERUM Pelembab Serum (2 in 1) untuk Wajah Berjerawat,40,233,Negatif
15125604731,https://shopee.co.id/FOREBIE-FIGHT-ACNE-MOIST-SERUM-Pelembab-Serum-(2-in-1)-untuk-Wajah-Berjerawat-i.806035446.14392136622?extraParams=%7B%22display_model_id%22%3A410421524133%2C%22model_selection_logic%22%3A3%7D,faishanapasorn,2,"Ku pake malah makin jerawat, kirain purging jadi terusin ternyata bukan. Yang mau di hilangin cuman 1 malah bertambah dan malah jadi jerawat besar dan bikin muka makin kusam. Sayang banget😭",FOREBIE FIGHT ACNE MOIST SERUM Pelembab Serum (2 in 1) untuk Wajah Berjerawat,31,189,Negatif
20684456647,https://shopee.co.id/FOREBIE-FIGHT-ACNE-MOIST-SERUM-Pelembab-Serum-(2-in-1)-untuk-Wajah-Berjerawat-i.806035446.14392136622?extraParams=%7B%22display_model_id%22%3A410421524133%2C%22model_selection_logic%22%3A3%7D,Anonim,2,"Cocok untuk: ya | Tekstur: ya | Efek: ya | Packaging barunya jelek PLIS ganti ke yg lama, yg ini ga bisa dibuka jd ada isinya dikit tp ga bisa diambil, padahal isinya masih ada",FOREBIE FIGHT ACNE MOIST SERUM Pelembab Serum (2 in 1) untuk Wajah Berjerawat,35,176,Negatif
25485050290,https://shopee.co.id/FOREBIE-FIGHT-ACNE-MOIST-SERUM-Pelembab-Serum-(2-in-1)-untuk-Wajah-Berjerawat-i.806035446.14392136622?extraParams=%7B%22display_model_id%22%3A410421524133%2C%22model_selection_logic%22%3A3%7D,apisbilal,2,ga cocok bikin purging lama bgt kulit aku type oily,FOREBIE FIGHT ACNE MOIST SERUM Pelembab Serum (2 in 1) untuk Wajah Berjerawat,10,51,Negatif
16061370652,https://shopee.co.id/FOREBIE-FIGHT-ACNE-MOIST-SERUM-Pelembab-Serum-(2-in-1)-untuk-Wajah-Berjerawat-i.806035446.14392136622?extraParams=%7B%22display_model_id%22%3A410421524133%2C%22model_selection_logic%22%3A3%7D,Anonim,2,"Cocok untuk: tidak cocok | Tekstur: gel | Efek: tidak cocok jerawat yang tadinya satu setelah pakai jerawat yang tadi nya satu jadi nambah,jadi beruntusan",FOREBIE FIGHT ACNE MOIST SERUM Pelembab Serum (2 in 1) untuk Wajah Berjerawat,25,154,Negatif
33458888494,https://shopee.co.id/FOREBIE-FIGHT-ACNE-MOIST-SERUM-Pelembab-Serum-(2-in-1)-untuk-Wajah-Berjerawat-i.806035446.14392136622?extraParams=%7B%22display_model_id%22%3A410421524133%2C%22model_selection_logic%22%3A3%7D,Anonim,2,"jujurly cuma pake 1x pump doang, sisa nya aku pl😖 | so sorry forebie😭",FOREBIE FIGHT ACNE MOIST SERUM Pelembab Serum (2 in 1) untuk Wajah Berjerawat,14,69,Negatif
87756701792,https://shopee.co.id/FOREBIE-FIGHT-ACNE-MOIST-SERUM-Pelembab-Serum-(2-in-1)-untuk-Wajah-Berjerawat-i.806035446.14392136622?extraParams=%7B%22display_model_id%22%3A410421524133%2C%22model_selection_logic%22%3A3%7D,tukudivickycell,2,"Maaf banget ya Ci,pdhl ak bela2in CO moist serum 2pcs free travel size fwash.tp stelah datang bkn fwash malah toner,pdhl fwash travel ak butuh buat liburan Ci.percuma dong tonernya gk kepake gratisanya,karna ak gk cocok sm toner.ak cocoknya itu fwash,moist serum n micelar aja.jdi sedih kalo gini😭😭😭",FOREBIE FIGHT ACNE MOIST SERUM Pelembab Serum (2 in 1) untuk Wajah Berjerawat,47,299,Negatif
99206096774,https://shopee.co.id/FOREBIE-FIGHT-ACNE-MOIST-SERUM-Pelembab-Serum-(2-in-1)-untuk-Wajah-Berjerawat-i.806035446.14392136622?extraParams=%7B%22display_model_id%22%3A410421524133%2C%22model_selection_logic%22%3A3%7D,Anonim,2,Tekstur: berat tapi cepat meresap | Penghapusan bruntusan: awalnya membantu tetapi lama kelamaan efek samping nya muncul,FOREBIE FIGHT ACNE MOIST SERUM Pelembab Serum (2 in 1) untuk Wajah Berjerawat,17,120,Negatif
14927573897,https://shopee.co.id/FOREBIE-FIGHT-ACNE-MOIST-SERUM-Pelembab-Serum-(2-in-1)-untuk-Wajah-Berjerawat-i.806035446.14392136622?extraParams=%7B%22display_model_id%22%3A410421524133%2C%22model_selection_logic%22%3A3%7D,ciicii9,2,Udah nunggu 1 bulan eh malah gak cocok,FOREBIE FIGHT ACNE MOIST SERUM Pelembab Serum (2 in 1) untuk Wajah Berjerawat,8,38,Negatif
75339146743,https://shopee.co.id/FOREBIE-FIGHT-ACNE-MOIST-SERUM-Pelembab-Serum-(2-in-1)-untuk-Wajah-Berjerawat-i.806035446.14392136622?extraParams=%7B%22display_model_id%22%3A410421524133%2C%22model_selection_logic%22%3A3%7D,Anonim,2,sebenarnya barangnya dateng dengan baik tp pengirimannya lama bgt,FOREBIE FIGHT ACNE MOIST SERUM Pelembab Serum (2 in 1) untuk Wajah Berjerawat,9,65,Negatif
95226502460,https://shopee.co.id/FOREBIE-FIGHT-ACNE-MOIST-SERUM-Pelembab-Serum-(2-in-1)-untuk-Wajah-Berjerawat-i.806035446.14392136622?extraParams=%7B%22display_model_id%22%3A410421524133%2C%22model_selection_logic%22%3A3%7D,aliyanisalutfia,2,PLSS GANTI PACKAGING,FOREBIE FIGHT ACNE MOIST SERUM Pelembab Serum (2 in 1) untuk Wajah Berjerawat,3,20,Negatif
21922698689,https://shopee.co.id/FOREBIE-FIGHT-ACNE-MOIST-SERUM-Pelembab-Serum-(2-in-1)-untuk-Wajah-Berjerawat-i.806035446.14392136622?extraParams=%7B%22display_model_id%22%3A410421524133%2C%22model_selection_logic%22%3A3%7D,irinenf_,2,"Respon Penjual: | Mohon maaf kak, apakah ada kendala? Minbie siap membantu terima kasih💖",FOREBIE FIGHT ACNE MOIST SERUM Pelembab Serum (2 in 1) untuk Wajah Berjerawat,14,88,Negatif
20210491477,https://shopee.co.id/FOREBIE-FIGHT-ACNE-MOIST-SERUM-Pelembab-Serum-(2-in-1)-untuk-Wajah-Berjerawat-i.806035446.14392136622?extraParams=%7B%22display_model_id%22%3A410421524133%2C%22model_selection_logic%22%3A3%7D,Anonim,2,Respon Penjual: | Makasih kak love you💖💖💖,FOREBIE FIGHT ACNE MOIST SERUM Pelembab Serum (2 in 1) untuk Wajah Berjerawat,7,41,Negatif
20148017348,https://shopee.co.id/FOREBIE-FIGHT-ACNE-MOIST-SERUM-Pelembab-Serum-(2-in-1)-untuk-Wajah-Berjerawat-i.806035446.14392136622?extraParams=%7B%22display_model_id%22%3A410421524133%2C%22model_selection_logic%22%3A3%7D,neyneyfjannat,2,Respon Penjual: | Makasih kak love you💖💖💖,FOREBIE FIGHT ACNE MOIST SERUM Pelembab Serum (2 in 1) untuk Wajah Berjerawat,7,41,Negatif
29682569113,https://shopee.co.id/FOREBIE-FIGHT-ACNE-MOIST-SERUM-Pelembab-Serum-(2-in-1)-untuk-Wajah-Berjerawat-i.806035446.14392136622?extraParams=%7B%22display_model_id%22%3A410421524133%2C%22model_selection_logic%22%3A3%7D,zahra.alhamid,2,Respon Penjual: | Mohon maaf kak apakah ada kendala? | Minbie siap membantu💖💖💖,FOREBIE FIGHT ACNE MOIST SERUM Pelembab Serum (2 in 1) untuk Wajah Berjerawat,13,78,Negatif
28936115028,https://shopee.co.id/FOREBIE-FIGHT-ACNE-MOIST-SERUM-Pelembab-Serum-(2-in-1)-untuk-Wajah-Berjerawat-i.806035446.14392136622?extraParams=%7B%22display_model_id%22%3A410421524133%2C%22model_selection_logic%22%3A3%7D,ibnufadilahamzanii,2,Respon Penjual: | Mohon maaf apakah ada kendala kak? | Minbie siap membantu🙏😭💖,FOREBIE FIGHT ACNE MOIST SERUM Pelembab Serum (2 in 1) untuk Wajah Berjerawat,13,78,Negatif
29957541103,https://shopee.co.id/FOREBIE-FIGHT-ACNE-MOIST-SERUM-Pelembab-Serum-(2-in-1)-untuk-Wajah-Berjerawat-i.806035446.14392136622?extraParams=%7B%22display_model_id%22%3A410421524133%2C%22model_selection_logic%22%3A3%7D,shilatobeborn,2,"Respon Penjual: | Mohon maaf kak, apakah ada kendala? | Minbie siap membantu🥹💖",FOREBIE FIGHT ACNE MOIST SERUM Pelembab Serum (2 in 1) untuk Wajah Berjerawat,13,78,Negatif
31757919154,https://shopee.co.id/FOREBIE-FIGHT-ACNE-MOIST-SERUM-Pelembab-Serum-(2-in-1)-untuk-Wajah-Berjerawat-i.806035446.14392136622?extraParams=%7B%22display_model_id%22%3A410421524133%2C%22model_selection_logic%22%3A3%7D,tonimbun,2,Respon Penjual: | Halo kak apakah ada kendala? | Minbie siap membantu ya💖💖💖,FOREBIE FIGHT ACNE MOIST SERUM Pelembab Serum (2 in 1) untuk Wajah Berjerawat,13,75,Negatif
16054126231,https://shopee.co.id/FOREBIE-FIGHT-ACNE-MOIST-SERUM-Pelembab-Serum-(2-in-1)-untuk-Wajah-Berjerawat-i.806035446.14392136622?extraParams=%7B%22display_model_id%22%3A410421524133%2C%22model_selection_logic%22%3A3%7D,evaepa190,2,"Respon Penjual: | Mohon maaf kak, apakah ada kendala? | Minbie siap membantu terima kasih💖💖💖",FOREBIE FIGHT ACNE MOIST SERUM Pelembab Serum (2 in 1) untuk Wajah Berjerawat,15,92,Negatif
15803863063,https://shopee.co.id/FOREBIE-FIGHT-ACNE-MOIST-SERUM-Pelembab-Serum-(2-in-1)-untuk-Wajah-Berjerawat-i.806035446.14392136622?extraParams=%7B%22display_model_id%22%3A410421524133%2C%22model_selection_logic%22%3A3%7D,ahmad0104a,2,"Respon Penjual: | Mohon maaf kak, apakah ada kendala? | Minbie siap membantu ya💖💖💖",FOREBIE FIGHT ACNE MOIST SERUM Pelembab Serum (2 in 1) untuk Wajah Berjerawat,14,82,Negatif
15605619225,https://shopee.co.id/FOREBIE-FIGHT-ACNE-MOIST-SERUM-Pelembab-Serum-(2-in-1)-untuk-Wajah-Berjerawat-i.806035446.14392136622?extraParams=%7B%22display_model_id%22%3A410421524133%2C%22model_selection_logic%22%3A3%7D,Anonim,3,"Cocok untuk: kulit berminyak | Tekstur: tidak lengket | efeknya ga keliatan, jerawat masih on off, dan saat pakai malah timbul jrwat baru, apakah ini efek purging atau ga cocok",FOREBIE FIGHT ACNE MOIST SERUM Pelembab Serum (2 in 1) untuk Wajah Berjerawat,30,176,Netral
30101489176,https://shopee.co.id/FOREBIE-FIGHT-ACNE-MOIST-SERUM-Pelembab-Serum-(2-in-1)-untuk-Wajah-Berjerawat-i.806035446.14392136622?extraParams=%7B%22display_model_id%22%3A410421524133%2C%22model_selection_logic%22%3A3%7D,Anonim,3,"Pengiriman cepat dan aman. Sudah pakai kurang lebih sebulan, tapi kayanya ga ada efek apa2 ya (padahal katanya di teman aku bagus), untuk jerawat yg sudah muncul baik kecil atau besar tdk ada efek jadi matang atau mengempis, untuk pencegahan jerawat kayanya ga ada sama aja, ga jadi lebih parah sih tapi juga muncul2 aja dg jumlah yg pada umumnya. Untuk produknya sendiri saat dipakai enak2 aja, ga lengket, ga yg aneh2.",FOREBIE FIGHT ACNE MOIST SERUM Pelembab Serum (2 in 1) untuk Wajah Berjerawat,72,420,Netral
16504134344,https://shopee.co.id/FOREBIE-FIGHT-ACNE-MOIST-SERUM-Pelembab-Serum-(2-in-1)-untuk-Wajah-Berjerawat-i.806035446.14392136622?extraParams=%7B%22display_model_id%22%3A410421524133%2C%22model_selection_logic%22%3A3%7D,Anonim,3,Cocok untuk: kulit sensitif | Tekstur: baik | Efek: lembab | Belum nyobain buat yang ganti packaging ini tapi keterangannya formulasi nya sama,FOREBIE FIGHT ACNE MOIST SERUM Pelembab Serum (2 in 1) untuk Wajah Berjerawat,23,142,Netral
