id_komentar,produk_url,username,rating,ulasan,nama_produk,jumlah_kata,panjang_karakter,label_sentimen
42252031770,https://shopee.co.id/BUNDLE-FOREBIE-CONFIDENT-SERIES-DAN-MICELLAR-WATER-Paket-Lengkap-Rawat-Kulit-Berjerawat-i.806035446.24840965949?extraParams=%7B%22display_model_id%22%3A195760069177%2C%22model_selection_logic%22%3A3%7D,nisaanasrulb,4,Baru nyampe nanti kucoba dlu baru update,BUNDLE FOREBIE CONFIDENT SERIES DAN MICELLAR WATER Paket Lengkap Rawat Kulit Berjerawat,7,40,Positif
94279958590,https://shopee.co.id/BUNDLE-FOREBIE-CONFIDENT-SERIES-DAN-MICELLAR-WATER-Paket-Lengkap-Rawat-Kulit-Berjerawat-i.806035446.24840965949?extraParams=%7B%22display_model_id%22%3A195760069177%2C%22model_selection_logic%22%3A3%7D,sept1yan123,4,"Pembersihan: baru coba 3 hari si | Efek: belum tau | Kualitas: kualitas nya si bagus . cumn host dilive nya telalu cetus .. jd males nnya"" dilive🙏 | Jd mls klo mau nnya pas live ..",BUNDLE FOREBIE CONFIDENT SERIES DAN MICELLAR WATER Paket Lengkap Rawat Kulit Berjerawat,37,180,Positif
47589928692,https://shopee.co.id/BUNDLE-FOREBIE-CONFIDENT-SERIES-DAN-MICELLAR-WATER-Paket-Lengkap-Rawat-Kulit-Berjerawat-i.806035446.24840965949?extraParams=%7B%22display_model_id%22%3A195760069177%2C%22model_selection_logic%22%3A3%7D,faiza_retnoningrum01,4,Bismillah semoga cocok😇,BUNDLE FOREBIE CONFIDENT SERIES DAN MICELLAR WATER Paket Lengkap Rawat Kulit Berjerawat,3,23,Positif
41528401948,https://shopee.co.id/BUNDLE-FOREBIE-CONFIDENT-SERIES-DAN-MICELLAR-WATER-Paket-Lengkap-Rawat-Kulit-Berjerawat-i.806035446.24840965949?extraParams=%7B%22display_model_id%22%3A195760069177%2C%22model_selection_logic%22%3A3%7D,atmapuspita08,4,"Belum bisa kasih bintang 5 karna baru pertama kali pake, ini wajah lagi tambah berjerawat tpi masih tetap pake mngkin karna lgi beradaptasi produknya",BUNDLE FOREBIE CONFIDENT SERIES DAN MICELLAR WATER Paket Lengkap Rawat Kulit Berjerawat,24,149,Positif
31422881420,https://shopee.co.id/BUNDLE-FOREBIE-CONFIDENT-SERIES-DAN-MICELLAR-WATER-Paket-Lengkap-Rawat-Kulit-Berjerawat-i.806035446.24840965949?extraParams=%7B%22display_model_id%22%3A195760069177%2C%22model_selection_logic%22%3A3%7D,djoaqueeenn,4,semoga cocok ya allah amin,BUNDLE FOREBIE CONFIDENT SERIES DAN MICELLAR WATER Paket Lengkap Rawat Kulit Berjerawat,5,26,Positif
88185579296,https://shopee.co.id/BUNDLE-FOREBIE-CONFIDENT-SERIES-DAN-MICELLAR-WATER-Paket-Lengkap-Rawat-Kulit-Berjerawat-i.806035446.24840965949?extraParams=%7B%22display_model_id%22%3A195760069177%2C%22model_selection_logic%22%3A3%7D,agatayuspita1008,4,"gercep bgtt.. akan di update nnt saat sudah pakai produknya.. dapat pouch jg, thanks seller🫰🏼",BUNDLE FOREBIE CONFIDENT SERIES DAN MICELLAR WATER Paket Lengkap Rawat Kulit Berjerawat,15,93,Positif
33724151689,https://shopee.co.id/BUNDLE-FOREBIE-CONFIDENT-SERIES-DAN-MICELLAR-WATER-Paket-Lengkap-Rawat-Kulit-Berjerawat-i.806035446.24840965949?extraParams=%7B%22display_model_id%22%3A195760069177%2C%22model_selection_logic%22%3A3%7D,Anonim,4,PO nya lumayan lama | Tapi untung ekspedisinya cepar jadi ga terlalu bete nungguin barangnya | Untum packiing aman,BUNDLE FOREBIE CONFIDENT SERIES DAN MICELLAR WATER Paket Lengkap Rawat Kulit Berjerawat,19,114,Positif
30856721664,https://shopee.co.id/BUNDLE-FOREBIE-CONFIDENT-SERIES-DAN-MICELLAR-WATER-Paket-Lengkap-Rawat-Kulit-Berjerawat-i.806035446.24840965949?extraParams=%7B%22display_model_id%22%3A195760069177%2C%22model_selection_logic%22%3A3%7D,marianachen17,4,Respon Penjual: | Makasih kak love you💖💖💖,BUNDLE FOREBIE CONFIDENT SERIES DAN MICELLAR WATER Paket Lengkap Rawat Kulit Berjerawat,7,41,Positif
31760697374,https://shopee.co.id/BUNDLE-FOREBIE-CONFIDENT-SERIES-DAN-MICELLAR-WATER-Paket-Lengkap-Rawat-Kulit-Berjerawat-i.806035446.24840965949?extraParams=%7B%22display_model_id%22%3A195760069177%2C%22model_selection_logic%22%3A3%7D,abdaurahman,4,Respon Penjual: | Makasih kak love you💖💖💖,BUNDLE FOREBIE CONFIDENT SERIES DAN MICELLAR WATER Paket Lengkap Rawat Kulit Berjerawat,7,41,Positif
31312369765,https://shopee.co.id/BUNDLE-FOREBIE-CONFIDENT-SERIES-DAN-MICELLAR-WATER-Paket-Lengkap-Rawat-Kulit-Berjerawat-i.806035446.24840965949?extraParams=%7B%22display_model_id%22%3A195760069177%2C%22model_selection_logic%22%3A3%7D,phutusuantini,4,Respon Penjual: | Makasih kak love you💖💖💖,BUNDLE FOREBIE CONFIDENT SERIES DAN MICELLAR WATER Paket Lengkap Rawat Kulit Berjerawat,7,41,Positif
34658314748,https://shopee.co.id/BUNDLE-FOREBIE-CONFIDENT-SERIES-DAN-MICELLAR-WATER-Paket-Lengkap-Rawat-Kulit-Berjerawat-i.806035446.24840965949?extraParams=%7B%22display_model_id%22%3A195760069177%2C%22model_selection_logic%22%3A3%7D,fhitrianyherzah,4,Respon Penjual: | Makasih kak love you💖💖💖,BUNDLE FOREBIE CONFIDENT SERIES DAN MICELLAR WATER Paket Lengkap Rawat Kulit Berjerawat,7,41,Positif
39153311379,https://shopee.co.id/BUNDLE-FOREBIE-CONFIDENT-SERIES-DAN-MICELLAR-WATER-Paket-Lengkap-Rawat-Kulit-Berjerawat-i.806035446.24840965949?extraParams=%7B%22display_model_id%22%3A195760069177%2C%22model_selection_logic%22%3A3%7D,izdihar.afifah10,4,Respon Penjual: | Makasih kak love you💖💖💖,BUNDLE FOREBIE CONFIDENT SERIES DAN MICELLAR WATER Paket Lengkap Rawat Kulit Berjerawat,7,41,Positif
85298945353,https://shopee.co.id/BUNDLE-FOREBIE-CONFIDENT-SERIES-DAN-MICELLAR-WATER-Paket-Lengkap-Rawat-Kulit-Berjerawat-i.806035446.24840965949?extraParams=%7B%22display_model_id%22%3A195760069177%2C%22model_selection_logic%22%3A3%7D,nadhyra_vn,4,"Respon Penjual: | makasih yaa kak, love youu🥹🥹💖",BUNDLE FOREBIE CONFIDENT SERIES DAN MICELLAR WATER Paket Lengkap Rawat Kulit Berjerawat,8,47,Positif
35849286018,https://shopee.co.id/BUNDLE-FOREBIE-CONFIDENT-SERIES-DAN-MICELLAR-WATER-Paket-Lengkap-Rawat-Kulit-Berjerawat-i.806035446.24840965949?extraParams=%7B%22display_model_id%22%3A195760069177%2C%22model_selection_logic%22%3A3%7D,viivi2704,4,Respon Penjual: | Makasih ka love you💖💖💖,BUNDLE FOREBIE CONFIDENT SERIES DAN MICELLAR WATER Paket Lengkap Rawat Kulit Berjerawat,7,40,Positif
36151541501,https://shopee.co.id/BUNDLE-FOREBIE-CONFIDENT-SERIES-DAN-MICELLAR-WATER-Paket-Lengkap-Rawat-Kulit-Berjerawat-i.806035446.24840965949?extraParams=%7B%22display_model_id%22%3A195760069177%2C%22model_selection_logic%22%3A3%7D,Anonim,4,Respon Penjual: | Makasih kak love you🙏💖💖💖,BUNDLE FOREBIE CONFIDENT SERIES DAN MICELLAR WATER Paket Lengkap Rawat Kulit Berjerawat,7,42,Positif
40195939832,https://shopee.co.id/BUNDLE-FOREBIE-CONFIDENT-SERIES-DAN-MICELLAR-WATER-Paket-Lengkap-Rawat-Kulit-Berjerawat-i.806035446.24840965949?extraParams=%7B%22display_model_id%22%3A195760069177%2C%22model_selection_logic%22%3A3%7D,juwitapuspadewi_,4,Respon Penjual: | Makasih kak love you😇💖💖💖,BUNDLE FOREBIE CONFIDENT SERIES DAN MICELLAR WATER Paket Lengkap Rawat Kulit Berjerawat,7,42,Positif
84319686371,https://shopee.co.id/BUNDLE-FOREBIE-CONFIDENT-SERIES-DAN-MICELLAR-WATER-Paket-Lengkap-Rawat-Kulit-Berjerawat-i.806035446.24840965949?extraParams=%7B%22display_model_id%22%3A195760069177%2C%22model_selection_logic%22%3A3%7D,madani5545,4,"Respon Penjual: | makasih yaa kak, love youu🥹🥹💖",BUNDLE FOREBIE CONFIDENT SERIES DAN MICELLAR WATER Paket Lengkap Rawat Kulit Berjerawat,8,47,Positif
39688849202,https://shopee.co.id/BUNDLE-FOREBIE-CONFIDENT-SERIES-DAN-MICELLAR-WATER-Paket-Lengkap-Rawat-Kulit-Berjerawat-i.806035446.24840965949?extraParams=%7B%22display_model_id%22%3A195760069177%2C%22model_selection_logic%22%3A3%7D,naulahidayati,4,Respon Penjual: | Makasih kak love you💖💖💖,BUNDLE FOREBIE CONFIDENT SERIES DAN MICELLAR WATER Paket Lengkap Rawat Kulit Berjerawat,7,41,Positif
31861616185,https://shopee.co.id/BUNDLE-FOREBIE-CONFIDENT-SERIES-DAN-MICELLAR-WATER-Paket-Lengkap-Rawat-Kulit-Berjerawat-i.806035446.24840965949?extraParams=%7B%22display_model_id%22%3A195760069177%2C%22model_selection_logic%22%3A3%7D,Anonim,5,"Efek: Membuat close komedo jadi keluarrr dan matang | Kualitas: Sangat baguss | Moist serum pembelian ketiga, karna cocok, jadi beli paket bundle nya😍 | Di bulan pertama close komedo masi gamau keluar, dibulan kedua close komedo pada keluar dan matang, sangat membersihkan sekali pori pori yang tersumbat, akan selalu repurchase😍 | Semoga dibulan ketiga dan seterusnya wajah bersih dari jerawat, Aamiin🤲🏻",BUNDLE FOREBIE CONFIDENT SERIES DAN MICELLAR WATER Paket Lengkap Rawat Kulit Berjerawat,62,404,Positif
40685590200,https://shopee.co.id/BUNDLE-FOREBIE-CONFIDENT-SERIES-DAN-MICELLAR-WATER-Paket-Lengkap-Rawat-Kulit-Berjerawat-i.806035446.24840965949?extraParams=%7B%22display_model_id%22%3A195760069177%2C%22model_selection_logic%22%3A3%7D,,5,"Kondisi Barang: terima dengan baik dan aman sampai tujuan pengemasan sangat aman | Efek: baguss | Kualitas: sangat bagus | Beli ke 3 kalinya mulai dari toner essence serum moist, kalo face wash ke 2 ini baguss jerawat aku sembuh uda jarang banget jerawat on off 😭",BUNDLE FOREBIE CONFIDENT SERIES DAN MICELLAR WATER Paket Lengkap Rawat Kulit Berjerawat,47,263,Positif
40567156554,https://shopee.co.id/BUNDLE-FOREBIE-CONFIDENT-SERIES-DAN-MICELLAR-WATER-Paket-Lengkap-Rawat-Kulit-Berjerawat-i.806035446.24840965949?extraParams=%7B%22display_model_id%22%3A195760069177%2C%22model_selection_logic%22%3A3%7D,chadiqotuljannah23,5,"Kondisi Barang: baik | Efek: jerawat mereda | Kualitas: bagus | Pembelian ke 2 aku.. | 2 minggu pertama emang purging di aku karna aku ada close comedo, semoga bisa sembuh total pakai forebi",BUNDLE FOREBIE CONFIDENT SERIES DAN MICELLAR WATER Paket Lengkap Rawat Kulit Berjerawat,34,190,Positif
39377216888,https://shopee.co.id/BUNDLE-FOREBIE-CONFIDENT-SERIES-DAN-MICELLAR-WATER-Paket-Lengkap-Rawat-Kulit-Berjerawat-i.806035446.24840965949?extraParams=%7B%22display_model_id%22%3A195760069177%2C%22model_selection_logic%22%3A3%7D,dwiintanmangalik,5,"Kondisi Barang: di terima dengan keadaan baik, bubble wrapnya juga tebel banget jadi aman banget terus aku juga dapat pouch lucuu, makasih yahh kakk | Semoga cocok di aku",BUNDLE FOREBIE CONFIDENT SERIES DAN MICELLAR WATER Paket Lengkap Rawat Kulit Berjerawat,29,170,Positif
39153114607,https://shopee.co.id/BUNDLE-FOREBIE-CONFIDENT-SERIES-DAN-MICELLAR-WATER-Paket-Lengkap-Rawat-Kulit-Berjerawat-i.806035446.24840965949?extraParams=%7B%22display_model_id%22%3A195760069177%2C%22model_selection_logic%22%3A3%7D,fadhillagh,5,"Kondisi Barang: diterima dengan baik | Efek: belum dicoba semua | Kualitas: bagus | Cocok facial wash & moistnya, akhirnya coba beli lagi yang paket lengkap.. setelah pre order 1 bulan datang juga",BUNDLE FOREBIE CONFIDENT SERIES DAN MICELLAR WATER Paket Lengkap Rawat Kulit Berjerawat,33,196,Positif
40950489885,https://shopee.co.id/BUNDLE-FOREBIE-CONFIDENT-SERIES-DAN-MICELLAR-WATER-Paket-Lengkap-Rawat-Kulit-Berjerawat-i.806035446.24840965949?extraParams=%7B%22display_model_id%22%3A195760069177%2C%22model_selection_logic%22%3A3%7D,gea_258,5,"Kondisi Barang: baik , bubble wrap tebel | Kualitas: kandungan nya sangat bagus | Efek: menenangkan kulit, membersihkan dan mencerahkan | Udah 3 hari pemkaian sejauh ini sih aman ya, komedo pada mateng, sangat membersihkan muka. 3 hari aja udh kayak keliatan dong muka sehat nya. Facial wash nya juga gentle, moist nya mantul, utk muka ku yg acne to dry sejauh ini aman.",BUNDLE FOREBIE CONFIDENT SERIES DAN MICELLAR WATER Paket Lengkap Rawat Kulit Berjerawat,64,370,Positif
78050871142,https://shopee.co.id/BUNDLE-FOREBIE-CONFIDENT-SERIES-DAN-MICELLAR-WATER-Paket-Lengkap-Rawat-Kulit-Berjerawat-i.806035446.24840965949?extraParams=%7B%22display_model_id%22%3A195760069177%2C%22model_selection_logic%22%3A3%7D,Anonim,5,"Kondisi Barang: baik | Kualitas: sangat bagus | Keaslian: asli | pakai forebie jerawatku jdi sembuh dan jarang dateng, paling pas lagi haid aja",BUNDLE FOREBIE CONFIDENT SERIES DAN MICELLAR WATER Paket Lengkap Rawat Kulit Berjerawat,24,143,Positif
39377035183,https://shopee.co.id/BUNDLE-FOREBIE-CONFIDENT-SERIES-DAN-MICELLAR-WATER-Paket-Lengkap-Rawat-Kulit-Berjerawat-i.806035446.24840965949?extraParams=%7B%22display_model_id%22%3A195760069177%2C%22model_selection_logic%22%3A3%7D,Anonim,5,"Kondisi Barang: semua bersegel, dapat pouch lagi | Efek: udah pernah pake yg serum mosturizernya cocok utk kulitku yg oily dan jerawat on off | Kualitas: bagusss | Harganya terjangkau tapi kandungannya oke",BUNDLE FOREBIE CONFIDENT SERIES DAN MICELLAR WATER Paket Lengkap Rawat Kulit Berjerawat,33,205,Positif
39153386155,https://shopee.co.id/BUNDLE-FOREBIE-CONFIDENT-SERIES-DAN-MICELLAR-WATER-Paket-Lengkap-Rawat-Kulit-Berjerawat-i.806035446.24840965949?extraParams=%7B%22display_model_id%22%3A195760069177%2C%22model_selection_logic%22%3A3%7D,Anonim,5,Kondisi Barang: diterima dlm keadaan baik | Efek: belum terlihat efeknya. masih dlm proses pemakaian. semoga aja cocok dgn kulit ku | Kualitas: memenuhi standar yg diharapkan | Pertama kalinya mencoba produk forebie. Produknya nyaman dipakai. Sejauh ini tidak ada iritasi atau kemerahan dikulit. Tentang hasilnya belum terlihat adanya perubahan di kulit ku. Semoga aja cocok & seperti yg ku harapkan. Kalau cocok mau order selanjutnya ☺️,BUNDLE FOREBIE CONFIDENT SERIES DAN MICELLAR WATER Paket Lengkap Rawat Kulit Berjerawat,67,437,Positif
42883288376,https://shopee.co.id/BUNDLE-FOREBIE-CONFIDENT-SERIES-DAN-MICELLAR-WATER-Paket-Lengkap-Rawat-Kulit-Berjerawat-i.806035446.24840965949?extraParams=%7B%22display_model_id%22%3A195760069177%2C%22model_selection_logic%22%3A3%7D,felialdiatiqtitania,5,"Kondisi Barang: amaan bagus | Kualitas: joss orii mantul | Efek: mantepp | bagus bgt lucu keinget yakult wkwkwk. cleansernya soft gaada aroma apapun cocok, jerawatku sekali pake lsg kek mateng trs keluar kering gitu loh. dpt free pouch juga huhu kiyowo, packing bubble wrap sangat aman dan double2. packaging produknya sendiri sangat amaze sih akuu, seniat itu dgn harga affordable. serumnya ada tutupnya gt biar ga tumpah, cleansernya jg sistem locknya gampang dan ga susah buat buka tutup+aman bgt kalo buat traveling. micellarnya jg ok, tonernya jg spraynya sangat bulet merata ke wajah jd ga 1 titik aj. besttt!!!! suka banget, worth to try n buyy🤯🫰🏻",BUNDLE FOREBIE CONFIDENT SERIES DAN MICELLAR WATER Paket Lengkap Rawat Kulit Berjerawat,107,654,Positif
71519201224,https://shopee.co.id/BUNDLE-FOREBIE-CONFIDENT-SERIES-DAN-MICELLAR-WATER-Paket-Lengkap-Rawat-Kulit-Berjerawat-i.806035446.24840965949?extraParams=%7B%22display_model_id%22%3A195760069177%2C%22model_selection_logic%22%3A3%7D,alexchndr,5,Kondisi Barang: diterima dengan keadaan baik | Kualitas: bagus untuk pemakaian 1 bulan udah mulai terlihat efeknya | Keaslian: produk autentik | Dapat bonus pouch bag terimakasih,BUNDLE FOREBIE CONFIDENT SERIES DAN MICELLAR WATER Paket Lengkap Rawat Kulit Berjerawat,27,178,Positif
41676968672,https://shopee.co.id/BUNDLE-FOREBIE-CONFIDENT-SERIES-DAN-MICELLAR-WATER-Paket-Lengkap-Rawat-Kulit-Berjerawat-i.806035446.24840965949?extraParams=%7B%22display_model_id%22%3A195760069177%2C%22model_selection_logic%22%3A3%7D,Anonim,5,"Kondisi Barang: baik | Kualitas: bagus | ternyata dapat 2 cleanser kali aja adek aku cocok biar bisa beli lagi, dikasih thank u card juga lucu banget lagi ya tuhan,, SUKSES TERUS KAKAK FOREBIE 🩷🌷🎀",BUNDLE FOREBIE CONFIDENT SERIES DAN MICELLAR WATER Paket Lengkap Rawat Kulit Berjerawat,35,196,Positif
34215617918,https://shopee.co.id/BUNDLE-FOREBIE-CONFIDENT-SERIES-DAN-MICELLAR-WATER-Paket-Lengkap-Rawat-Kulit-Berjerawat-i.806035446.24840965949?extraParams=%7B%22display_model_id%22%3A195760069177%2C%22model_selection_logic%22%3A3%7D,gaidafitrilutfiah,5,"Kondisi Barang: diterima dengan keadaan aman dan baik | Barang dateng dengan selamat dan aman, pengiriman cepat, barang tidak ada yang bocor, ini pertama kali coba, semoga pakai ini cocok😊",BUNDLE FOREBIE CONFIDENT SERIES DAN MICELLAR WATER Paket Lengkap Rawat Kulit Berjerawat,30,188,Positif
45107792382,https://shopee.co.id/BUNDLE-FOREBIE-CONFIDENT-SERIES-DAN-MICELLAR-WATER-Paket-Lengkap-Rawat-Kulit-Berjerawat-i.806035446.24840965949?extraParams=%7B%22display_model_id%22%3A195760069177%2C%22model_selection_logic%22%3A3%7D,Anonim,5,"Kondisi Barang: baik | Kualitas: baguss | Efek: mengurangi minyak di wajah, bagus utk jerawat juga | Udh beberapa kali pakai, cocok pake produk ini, kali ini nyoba co micellar water nya juga",BUNDLE FOREBIE CONFIDENT SERIES DAN MICELLAR WATER Paket Lengkap Rawat Kulit Berjerawat,33,190,Positif
41375026689,https://shopee.co.id/BUNDLE-FOREBIE-CONFIDENT-SERIES-DAN-MICELLAR-WATER-Paket-Lengkap-Rawat-Kulit-Berjerawat-i.806035446.24840965949?extraParams=%7B%22display_model_id%22%3A195760069177%2C%22model_selection_logic%22%3A3%7D,printya_store,5,"“Produk sangat bagus, sesuai deskripsi!” | “Kualitas mantap, pengiriman cepat.” | “Sangat puas dengan belanja di sini.” | “Barang oke, recommended seller.” | “Produk berkualitas tinggi, sangat puas.” | “Harga terjangkau, kualitas luar biasa.”",BUNDLE FOREBIE CONFIDENT SERIES DAN MICELLAR WATER Paket Lengkap Rawat Kulit Berjerawat,34,242,Positif
33001948318,https://shopee.co.id/BUNDLE-FOREBIE-CONFIDENT-SERIES-DAN-MICELLAR-WATER-Paket-Lengkap-Rawat-Kulit-Berjerawat-i.806035446.24840965949?extraParams=%7B%22display_model_id%22%3A195760069177%2C%22model_selection_logic%22%3A3%7D,Anonim,5,"Kondisi Barang: diterima dalam keadaan baik | Efek: bagus | Kualitas: terjamin dengan standar tinggi | Oke, goodd",BUNDLE FOREBIE CONFIDENT SERIES DAN MICELLAR WATER Paket Lengkap Rawat Kulit Berjerawat,18,113,Positif
78050885883,https://shopee.co.id/BUNDLE-FOREBIE-CONFIDENT-SERIES-DAN-MICELLAR-WATER-Paket-Lengkap-Rawat-Kulit-Berjerawat-i.806035446.24840965949?extraParams=%7B%22display_model_id%22%3A195760069177%2C%22model_selection_logic%22%3A3%7D,Anonim,5,"Kondisi Barang: baik | Kualitas: sangat bagus | Keaslian: asli | forebie bagus bgt, jerawatku jdi ilang dan jarang dateng",BUNDLE FOREBIE CONFIDENT SERIES DAN MICELLAR WATER Paket Lengkap Rawat Kulit Berjerawat,20,121,Positif
65826888452,https://shopee.co.id/BUNDLE-FOREBIE-CONFIDENT-SERIES-DAN-MICELLAR-WATER-Paket-Lengkap-Rawat-Kulit-Berjerawat-i.806035446.24840965949?extraParams=%7B%22display_model_id%22%3A195760069177%2C%22model_selection_logic%22%3A3%7D,matursuwon04,5,Kondisi Barang: sangat baik kak | Kualitas: sangat bagus kulitku tidak panas atau sakit aman | Keaslian: sangat bagus | mohon maaf kalo suaraku kayak pikachu ya kak ku percepat soalnya biar bisa di upload 😭🙏 | doakan cocok ya kak aq coba sabun ya tidak panas atau sakit di wajah moga seterusnya cocok ya kak amiin,BUNDLE FOREBIE CONFIDENT SERIES DAN MICELLAR WATER Paket Lengkap Rawat Kulit Berjerawat,57,313,Positif
47406354031,https://shopee.co.id/BUNDLE-FOREBIE-CONFIDENT-SERIES-DAN-MICELLAR-WATER-Paket-Lengkap-Rawat-Kulit-Berjerawat-i.806035446.24840965949?extraParams=%7B%22display_model_id%22%3A195760069177%2C%22model_selection_logic%22%3A3%7D,htyg_rutg1,5,"Kondisi Barang: sangat baik aman | Kualitas: bagus ini paket ke 2 kalinya beli | Efek: ngilangin acne fighter,beruntus kecil”",BUNDLE FOREBIE CONFIDENT SERIES DAN MICELLAR WATER Paket Lengkap Rawat Kulit Berjerawat,20,125,Positif
31773280747,https://shopee.co.id/BUNDLE-FOREBIE-CONFIDENT-SERIES-DAN-MICELLAR-WATER-Paket-Lengkap-Rawat-Kulit-Berjerawat-i.806035446.24840965949?extraParams=%7B%22display_model_id%22%3A195760069177%2C%22model_selection_logic%22%3A3%7D,Anonim,5,Efek: bagus | setiap barang sampe pasti harganya turun sekarang murah wey kemarin pas co 300k menangisss,BUNDLE FOREBIE CONFIDENT SERIES DAN MICELLAR WATER Paket Lengkap Rawat Kulit Berjerawat,17,104,Positif
39148620644,https://shopee.co.id/BUNDLE-FOREBIE-CONFIDENT-SERIES-DAN-MICELLAR-WATER-Paket-Lengkap-Rawat-Kulit-Berjerawat-i.806035446.24840965949?extraParams=%7B%22display_model_id%22%3A195760069177%2C%22model_selection_logic%22%3A3%7D,Anonim,5,"Kondisi Barang: baik | Efek: belom tau | Kualitas: bagus | paketnya barusan sampe, semoga cocok🫶",BUNDLE FOREBIE CONFIDENT SERIES DAN MICELLAR WATER Paket Lengkap Rawat Kulit Berjerawat,16,96,Positif
42883430465,https://shopee.co.id/BUNDLE-FOREBIE-CONFIDENT-SERIES-DAN-MICELLAR-WATER-Paket-Lengkap-Rawat-Kulit-Berjerawat-i.806035446.24840965949?extraParams=%7B%22display_model_id%22%3A195760069177%2C%22model_selection_logic%22%3A3%7D,Anonim,5,Kondisi Barang: oke | Kualitas: terjamin | Efek: okebanget | Suka banget | Uda repurchase ke berapa inii | Sukaa polll | Ngaruh di aku,BUNDLE FOREBIE CONFIDENT SERIES DAN MICELLAR WATER Paket Lengkap Rawat Kulit Berjerawat,25,134,Positif
38826234019,https://shopee.co.id/BUNDLE-FOREBIE-CONFIDENT-SERIES-DAN-MICELLAR-WATER-Paket-Lengkap-Rawat-Kulit-Berjerawat-i.806035446.24840965949?extraParams=%7B%22display_model_id%22%3A195760069177%2C%22model_selection_logic%22%3A3%7D,Anonim,5,okelah overall walaupun PO nya lama banget emang  but the skincare is good,BUNDLE FOREBIE CONFIDENT SERIES DAN MICELLAR WATER Paket Lengkap Rawat Kulit Berjerawat,13,74,Positif
38826916147,https://shopee.co.id/BUNDLE-FOREBIE-CONFIDENT-SERIES-DAN-MICELLAR-WATER-Paket-Lengkap-Rawat-Kulit-Berjerawat-i.806035446.24840965949?extraParams=%7B%22display_model_id%22%3A195760069177%2C%22model_selection_logic%22%3A3%7D,an_nnisa23,5,"Kondisi Barang: baikk safety bangeddd 👍 | Kualitas: memenuhi expetasii | Ga expect klo se safety dan se bagus ini , | Paket lengkap baru nyoba ini , biasanya essens sama moisturizer nya aj , coba dlu siapa tau jodoh sama muka . | Terimakasih kak 😙🫰",BUNDLE FOREBIE CONFIDENT SERIES DAN MICELLAR WATER Paket Lengkap Rawat Kulit Berjerawat,47,248,Positif
83959409867,https://shopee.co.id/Bundle-Forebie-Fight-Acne-Moist-Serum-Dan-Gentle-Moisturizing-Cream-i.806035446.50952629334?extraParams=%7B%22display_model_id%22%3A302230196534%2C%22model_selection_logic%22%3A3%7D,Anonim,1,PENIPUAN BANNER!!! DI TULIS 1-2JANUARI PEMESANAN TANPA MIN.BELANJA DAPAT FREE TONER 20ML! SAYA PESAN 3 PAKET YG DATANG HANYA 1 FREE TONER. PADAHAL HARUSNYA 3 TONER FREE! MENDING KLO MAU PROMO YANG JELAS2 AJA! INI MENIPU LOH!!! AKU UDAH TULIS DI NOTE JUGA! TOLONG KIRIM SESUAI DESKRIPSI GAMBAR! IHHHHH PARAH KECEWA BERAT SIH!,Bundle Forebie Fight Acne Moist Serum Dan Gentle Moisturizing Cream,53,324,Negatif
83009511454,https://shopee.co.id/Bundle-Forebie-Fight-Acne-Moist-Serum-Dan-Gentle-Moisturizing-Cream-i.806035446.50952629334?extraParams=%7B%22display_model_id%22%3A302230196534%2C%22model_selection_logic%22%3A3%7D,nurialazhari,3,Respon Penjual: | Makasih ya kak love you💖🥹🥹,Bundle Forebie Fight Acne Moist Serum Dan Gentle Moisturizing Cream,8,44,Netral
86724493576,https://shopee.co.id/Bundle-Forebie-Fight-Acne-Moist-Serum-Dan-Gentle-Moisturizing-Cream-i.806035446.50952629334?extraParams=%7B%22display_model_id%22%3A302230196534%2C%22model_selection_logic%22%3A3%7D,lrobandria,4,Cocok untuk: kulit berjerawat | Daya Serap: lumayan | Tekstur: lembut | Harga lumayan mahal tp masih berjerawat,Bundle Forebie Fight Acne Moist Serum Dan Gentle Moisturizing Cream,18,111,Positif
83649704855,https://shopee.co.id/Bundle-Forebie-Fight-Acne-Moist-Serum-Dan-Gentle-Moisturizing-Cream-i.806035446.50952629334?extraParams=%7B%22display_model_id%22%3A302230196534%2C%22model_selection_logic%22%3A3%7D,myuuuuu13,4,Alhamdulillah beli bundle dpt gratisan facial wash | First time pake forebie semoga cocok,Bundle Forebie Fight Acne Moist Serum Dan Gentle Moisturizing Cream,14,89,Positif
84171987854,https://shopee.co.id/Bundle-Forebie-Fight-Acne-Moist-Serum-Dan-Gentle-Moisturizing-Cream-i.806035446.50952629334?extraParams=%7B%22display_model_id%22%3A302230196534%2C%22model_selection_logic%22%3A3%7D,sagala21,4,"Respon Penjual: | makasih yaa kak, love youu🥹🥹💖",Bundle Forebie Fight Acne Moist Serum Dan Gentle Moisturizing Cream,8,47,Positif
95005527924,https://shopee.co.id/Bundle-Forebie-Fight-Acne-Moist-Serum-Dan-Gentle-Moisturizing-Cream-i.806035446.50952629334?extraParams=%7B%22display_model_id%22%3A302230196534%2C%22model_selection_logic%22%3A3%7D,dva_nbla,4,"Respon Penjual: | makasih yaa kak, love youu🥹🥹💖",Bundle Forebie Fight Acne Moist Serum Dan Gentle Moisturizing Cream,8,47,Positif
83356713926,https://shopee.co.id/Bundle-Forebie-Fight-Acne-Moist-Serum-Dan-Gentle-Moisturizing-Cream-i.806035446.50952629334?extraParams=%7B%22display_model_id%22%3A302230196534%2C%22model_selection_logic%22%3A3%7D,felizanurul19,4,"Respon Penjual: | makasih yaa kak, love youu🥹🥹💖",Bundle Forebie Fight Acne Moist Serum Dan Gentle Moisturizing Cream,8,47,Positif
94892810776,https://shopee.co.id/Bundle-Forebie-Fight-Acne-Moist-Serum-Dan-Gentle-Moisturizing-Cream-i.806035446.50952629334?extraParams=%7B%22display_model_id%22%3A302230196534%2C%22model_selection_logic%22%3A3%7D,Anonim,4,"Respon Penjual: | makasih yaa kak, love youu🥹🥹💖",Bundle Forebie Fight Acne Moist Serum Dan Gentle Moisturizing Cream,8,47,Positif
96679860397,https://shopee.co.id/Bundle-Forebie-Fight-Acne-Moist-Serum-Dan-Gentle-Moisturizing-Cream-i.806035446.50952629334?extraParams=%7B%22display_model_id%22%3A302230196534%2C%22model_selection_logic%22%3A3%7D,teguh9312,4,"Respon Penjual: | terima kasih yaa kak, love youu🥹🥹💖",Bundle Forebie Fight Acne Moist Serum Dan Gentle Moisturizing Cream,9,52,Positif
81673355499,https://shopee.co.id/Bundle-Forebie-Fight-Acne-Moist-Serum-Dan-Gentle-Moisturizing-Cream-i.806035446.50952629334?extraParams=%7B%22display_model_id%22%3A302230196534%2C%22model_selection_logic%22%3A3%7D,zahraashifa947,4,"Respon Penjual: | makasih yaa kak, love youu🥹🥹💖",Bundle Forebie Fight Acne Moist Serum Dan Gentle Moisturizing Cream,8,47,Positif
82027486633,https://shopee.co.id/Bundle-Forebie-Fight-Acne-Moist-Serum-Dan-Gentle-Moisturizing-Cream-i.806035446.50952629334?extraParams=%7B%22display_model_id%22%3A302230196534%2C%22model_selection_logic%22%3A3%7D,mawarjasmine,4,"Respon Penjual: | makasih yaa kak, love youu🥹🥹💖",Bundle Forebie Fight Acne Moist Serum Dan Gentle Moisturizing Cream,8,47,Positif
