id_komentar,produk_url,username,rating,ulasan
72866935911,https://shopee.co.id/Samsung-Galaxy-A07-4-64GB-Black-i.52635036.43962255887?extraParams=%7B%22display_model_id%22%3A301025014642%2C%22model_selection_logic%22%3A3%7D,fath_rohman13,5,Kondisi Barang: bagus memuaskan | Fungsi: berjalan dengan normal | Keaslian: real | alhamdulillah paket datang dengan aman dan selamat | gk ada lecet sedikit pun | pokoknya beli disini di jamin bagus
74185940203,https://shopee.co.id/Samsung-Galaxy-A07-4-64GB-Black-i.52635036.43962255887?extraParams=%7B%22display_model_id%22%3A301025014642%2C%22model_selection_logic%22%3A3%7D,ranni11,5,Kondisi Barang: aman n unboxing di dpn kurir walaupun pembelian via spay | Kinerja: penggunaan aman n ngecharge jg cepat | Keaslian: moga ori..hanya ja ga dpt kartu perdana XL
75297178452,https://shopee.co.id/Samsung-Galaxy-A07-4-64GB-Black-i.52635036.43962255887?extraParams=%7B%22display_model_id%22%3A301025014642%2C%22model_selection_logic%22%3A3%7D,jauharfalah,5,Kondisi Barang: diterima dalam keadaan baik | Kinerja: berfungsi dengan baik | Fitur: bagus sesuai harga | Paket sudah diterima dalam keadaan baik. | Semoga awet hp nya. | Terima kasih seller!
96086328811,https://shopee.co.id/Samsung-Galaxy-A07-4-64GB-Black-i.52635036.43962255887?extraParams=%7B%22display_model_id%22%3A301025014642%2C%22model_selection_logic%22%3A3%7D,Anonim,5,"Kinerja: baik | Kondisi: baik | baru review, bagus hp nya, fiturnya bagus dan termasuk terjangkau untuk samsung seri A"
75338950131,https://shopee.co.id/Samsung-Galaxy-A07-4-64GB-Black-i.52635036.43962255887?extraParams=%7B%22display_model_id%22%3A301025014642%2C%22model_selection_logic%22%3A3%7D,hz0rvget5e,5,Kondisi Barang: kondisi barang new mulus baguss | Kinerja: kinerja berfungsi dengan baik dan normal | Fitur: fitur terkini
72429292938,https://shopee.co.id/Samsung-Galaxy-A07-4-64GB-Black-i.52635036.43962255887?extraParams=%7B%22display_model_id%22%3A301025014642%2C%22model_selection_logic%22%3A3%7D,hodrimuhtarali,5,Kondisi Barang: kondisi bagus | Fungsi: berfungsi dengan baik | Keaslian: asli Samsung
76820818339,https://shopee.co.id/Samsung-Galaxy-A07-4-64GB-Black-i.52635036.43962255887?extraParams=%7B%22display_model_id%22%3A301025014642%2C%22model_selection_logic%22%3A3%7D,klik_mall,5,"Kondisi Barang: Keadaan baik, mulus, baru | Fungsi: 100% baru | Keaslian: 100% original | Baru beli pertama kali, 10:10 jam 00 harga 1,14jta, luar biasa pengiriman cepat, Barang original Samsung, kondisi baru, dapat gratis kepala charger. Sangat profesional, hpnya terbungkus sangat rapih dan kokoh, di segel kedua sisi atas bawah. Ini benar2 profesional toko official Samsung... Recommended kalian yang mau beli hp baru di officiapnya ini...."
85382318952,https://shopee.co.id/Samsung-Galaxy-A07-4-64GB-Black-i.52635036.43962255887?extraParams=%7B%22display_model_id%22%3A301025014642%2C%22model_selection_logic%22%3A3%7D,Anonim,5,Kondisi Barang: Datang dengan keadaan mulus | Keaslian: Original samsung | Fungsi: Beroperasi dengan baik | Penjual sangatlah ramah dan gercep
72847388726,https://shopee.co.id/Samsung-Galaxy-A07-4-64GB-Black-i.52635036.43962255887?extraParams=%7B%22display_model_id%22%3A301025014642%2C%22model_selection_logic%22%3A3%7D,Anonim,5,"Kondisi Barang: Aman | Fungsi: Bagus | Keaslian: asli | Alhamdulillah masha allah paketnya datengnya cepet banget harga murah bgt the best pokokna mh, mantap semoga awet"
96203724882,https://shopee.co.id/Samsung-Galaxy-A07-4-64GB-Black-i.52635036.43962255887?extraParams=%7B%22display_model_id%22%3A301025014642%2C%22model_selection_logic%22%3A3%7D,fida.afifah03,5,Kinerja: lancar | Kondisi: baru alhamdlillah tidak ada kendala | Bismillah awett makasih udh membuat produk yang murah Samsung
75504102606,https://shopee.co.id/Samsung-Galaxy-A07-4-64GB-Black-i.52635036.43962255887?extraParams=%7B%22display_model_id%22%3A301025014642%2C%22model_selection_logic%22%3A3%7D,akmalgolovkin,5,Kondisi Barang: mulus | Kinerja: baik | Fitur: bagus | Kondisi barang like new original 100% no minus no licett toko amanah bisa jadi langganan
72299270607,https://shopee.co.id/Samsung-Galaxy-A07-4-64GB-Black-i.52635036.43962255887?extraParams=%7B%22display_model_id%22%3A301025014642%2C%22model_selection_logic%22%3A3%7D,rinafikram,5,"Kondisi Barang: mulus,bagus | Fungsi: sangat baik | Keaslian: dijamin asli | Pengiriman cepat,dan jgn ragu order di sini dijamin hp nya original"
95952926798,https://shopee.co.id/Samsung-Galaxy-A07-4-64GB-Black-i.52635036.43962255887?extraParams=%7B%22display_model_id%22%3A301025014642%2C%22model_selection_logic%22%3A3%7D,hadi_multimedi,5,Kinerja: ponsel berfungsi baik dan lancar | Kondisi: saya menerima barang utuh segel nya masih rapat barang nya bagus
69936771492,https://shopee.co.id/Samsung-Galaxy-A07-4-64GB-Black-i.52635036.43962255887?extraParams=%7B%22display_model_id%22%3A301025014642%2C%22model_selection_logic%22%3A3%7D,bundashayanganandasllu,5,Kondisi Barang: dalam keadaan baik n aman | Keaslian: original asli | Kualitas: bagus | Mantap dah 4 hp belanja disini.gk pernah kecewa.sukses terus.makin jaya
72559701476,https://shopee.co.id/Samsung-Galaxy-A07-4-64GB-Black-i.52635036.43962255887?extraParams=%7B%22display_model_id%22%3A301025014642%2C%22model_selection_logic%22%3A3%7D,didiwijaya91,5,"Kondisi Barang: Bagus | Fungsi: Berfungsi baik | Keaslian: Asli | Pengiriman cepat, harga sepadan, sesuai pesanan. Recomendeed seller."
72866945035,https://shopee.co.id/Samsung-Galaxy-A07-4-64GB-Black-i.52635036.43962255887?extraParams=%7B%22display_model_id%22%3A301025014642%2C%22model_selection_logic%22%3A3%7D,danishedo,5,"Alhamdulillah hp nya udah sampai, bagus dan ori. Trimakasih banyak...."
75343937004,https://shopee.co.id/Samsung-Galaxy-A07-4-64GB-Black-i.52635036.43962255887?extraParams=%7B%22display_model_id%22%3A301025014642%2C%22model_selection_logic%22%3A3%7D,detriicha,5,Kondisi Barang: datang dalam keadaan mulus | Kinerja: berfungsi dengan baik | Fitur: bagus dan berguna | Sesuai ekspektasi dan sesuai kantong
72198182068,https://shopee.co.id/Samsung-Galaxy-A07-4-64GB-Black-i.52635036.43962255887?extraParams=%7B%22display_model_id%22%3A301025014642%2C%22model_selection_logic%22%3A3%7D,Anonim,5,0:05
69945585935,https://shopee.co.id/Samsung-Galaxy-A07-4-64GB-Black-i.52635036.43962255887?extraParams=%7B%22display_model_id%22%3A301025014642%2C%22model_selection_logic%22%3A3%7D,mardiyani479,5,Kondisi Barang: sangat baik | Keaslian: terjamin asli | Kualitas: bagus
69864937940,https://shopee.co.id/Samsung-Galaxy-A07-4-64GB-Black-i.52635036.43962255887?extraParams=%7B%22display_model_id%22%3A301025014642%2C%22model_selection_logic%22%3A3%7D,abdulkafimubarock,5,Fungsi: OK | Garansi: OK | Keren banget sehari sampe luar bisaa banget pelayannanya keren full 🤩🤩
75393129528,https://shopee.co.id/Samsung-Galaxy-A07-4-64GB-Black-i.52635036.43962255887?extraParams=%7B%22display_model_id%22%3A301025014642%2C%22model_selection_logic%22%3A3%7D,ita_dm83,5,"Kondisi Barang: keadaan mulus | Kinerja: berfungsi sesuai harapan | Fitur: bagus | Pengiriman cepat dan aman,sangat bagus terima kasih samsung semoga pemakaian awet untuk anakku..kedepannya kalau mau ganti hp aku akan order disini aja.."
72494257747,https://shopee.co.id/Samsung-Galaxy-A07-4-64GB-Black-i.52635036.43962255887?extraParams=%7B%22display_model_id%22%3A301025014642%2C%22model_selection_logic%22%3A3%7D,panduprayogapp8,5,"Kondisi Barang: bagus | Fungsi: berfungsi | Keaslian: asli | Barang sudah sampai... Kondisi aman tanpa kendala. Cuma sayang, gak dapat hadiah kartu paket XL 36 gb setahun"
75368714156,https://shopee.co.id/Samsung-Galaxy-A07-4-64GB-Black-i.52635036.43962255887?extraParams=%7B%22display_model_id%22%3A301025014642%2C%22model_selection_logic%22%3A3%7D,deviwai15,5,Kondisi Barang: datang dengan mulus | Kinerja: berfungsi dengan baik | Barang datang sesuai pesanan
95829382332,https://shopee.co.id/Samsung-Galaxy-A07-4-64GB-Black-i.52635036.43962255887?extraParams=%7B%22display_model_id%22%3A301025014642%2C%22model_selection_logic%22%3A3%7D,dalirasja8,5,"Kinerja: Berfungsi dengan baik | Kondisi: kondisi barang mulus dan segel | Sesuai dengan pesanan, real pict, saller amanah ,produk berkualitas original samsung, jangan ragu beli di toko ini di jamin original, makasih"
95786998738,https://shopee.co.id/Samsung-Galaxy-A07-4-64GB-Black-i.52635036.43962255887?extraParams=%7B%22display_model_id%22%3A301025014642%2C%22model_selection_logic%22%3A3%7D,mmhnazwa0,5,Alhamdulillah paket mendarat dengan aman | Terimakasih untuk toko ny terimakasih shopee dan Terimakasih bng kurir👍👍👍👍👍pengiriman cepat banget..jngan ragu belanja di toko ini mantullll abisss 😘😘😘😘😘
75372046201,https://shopee.co.id/Samsung-Galaxy-A07-4-64GB-Black-i.52635036.43962255887?extraParams=%7B%22display_model_id%22%3A301025014642%2C%22model_selection_logic%22%3A3%7D,nuritasilvia,5,Kondisi Barang: datang dengan keadaan mulus | Kinerja: berfungsi dengan baik | Fitur: bagus dan berguna | Kondisi bagus
75451179642,https://shopee.co.id/Samsung-Galaxy-A07-4-64GB-Black-i.52635036.43962255887?extraParams=%7B%22display_model_id%22%3A301025014642%2C%22model_selection_logic%22%3A3%7D,gerhana_larasati,5,Barang sesuai deskripsi dan berfungsi dengan baik.. packaging rapi.. terima kasih seller..
75288481522,https://shopee.co.id/Samsung-Galaxy-A07-4-64GB-Black-i.52635036.43962255887?extraParams=%7B%22display_model_id%22%3A301025014642%2C%22model_selection_logic%22%3A3%7D,Anonim,5,"Kondisi Barang: barang datang keadaan mulus namun belum dicoba | Kinerja: berfungsi namun belum seutuhnya | Fitur: bagus | Belum di coba seutuhnya, mudah-mudahan tidak ada kendala"
77226202668,https://shopee.co.id/Samsung-Galaxy-A07-4-64GB-Black-i.52635036.43962255887?extraParams=%7B%22display_model_id%22%3A301025014642%2C%22model_selection_logic%22%3A3%7D,adventmw,5,"Kondisi Barang: mulus | Fungsi: beroperasi dengan baik | Keaslian: asli | Kali ke 2 order di Samsung Official store, as always puas... Thanks Shopee and seller semoga selalu berkah dan amanah 🙏🙏🙏🙏"
72452807676,https://shopee.co.id/Samsung-Galaxy-A07-4-64GB-Black-i.52635036.43962255887?extraParams=%7B%22display_model_id%22%3A301025014642%2C%22model_selection_logic%22%3A3%7D,nmf354,5,"Kondisi Barang: dalam keadaan mulus, paking rapi | Fungsi: berfungsi | Keaslian: asli | Sudah sering order ditoko ini untuk saya jual lagi"
76332839893,https://shopee.co.id/Samsung-Galaxy-A07-4-64GB-Black-i.52635036.43962255887?extraParams=%7B%22display_model_id%22%3A301025014642%2C%22model_selection_logic%22%3A3%7D,Anonim,5,Kondisi Barang: barang datang dengan aman | Kinerja: berfungsi dengan baik | Keaslian: orihinal | Barang aman berfungsi dengan baik cuma jasa pengiriman shopee express lama banget ga sesuai estimasi
89836534882,https://shopee.co.id/Samsung-Galaxy-A07-4-64GB-Black-i.52635036.43962255887?extraParams=%7B%22display_model_id%22%3A301025014642%2C%22model_selection_logic%22%3A3%7D,Anonim,5,"Kondisi Barang: datang dalam keadaan mulus | Keaslian: kualitas original | Fungsi: handphone beroperasi dengan baik | Sudah 3x beli disini, amanah, packing rapi, terimakasih banyak, next beli lagi bolehlahhhh 🤗"
77680106246,https://shopee.co.id/Samsung-Galaxy-A07-4-64GB-Black-i.52635036.43962255887?extraParams=%7B%22display_model_id%22%3A301025014642%2C%22model_selection_logic%22%3A3%7D,Anonim,5,"Kondisi Barang: mulus seperti baru | Kinerja: melebihi ekspektasi dengan harga 1jt an, ini sudah lebih dari cukup untuk kebutuhan kerja yang notabene buka sosmed, file pdf dll, dokumentasi lapangan, batre lumayan awet di saya bisa 10 jam lebih pemakaian untuk 1x charging | Keaslian: asli ada wm samsung nya | HP budget yang paling worth it lah, diharga 1jt an"
94180946809,https://shopee.co.id/Samsung-Galaxy-A07-4-64GB-Black-i.52635036.43962255887?extraParams=%7B%22display_model_id%22%3A301025014642%2C%22model_selection_logic%22%3A3%7D,Anonim,5,"Kinerja: ponsel berfungsi dengan baik | Kondisi: segel utuh, kemasan rapi | Pengiriman standar, sudah termasuk kepala adaptor charger, pengemasan 1 lapis bubblewrap di kemas ulang dengan box shoppee. Semoga awet."
94902561066,https://shopee.co.id/Samsung-Galaxy-A07-4-64GB-Black-i.52635036.43962255887?extraParams=%7B%22display_model_id%22%3A301025014642%2C%22model_selection_logic%22%3A3%7D,rofiudin445,5,"Kinerja: alhamdillah berfungsi, smg awet | Kondisi: baru dan asli | Alhamdulillah hp sudah sampai yg d tgg anak saya, sukses samsung official, sukses selalu. Terima kasih pak kurir."
76692331775,https://shopee.co.id/Samsung-Galaxy-A07-4-64GB-Black-i.52635036.43962255887?extraParams=%7B%22display_model_id%22%3A301025014642%2C%22model_selection_logic%22%3A3%7D,mamia66,5,"Kondisi Barang: Alhamdulillah aman | Keaslian: sepertinya Original | sempet sedikit takut,takut barangnya datang tidak sesuai pesanan,tapi setelah di buka...ternyata bener2 bagus,karena belum beli kartu jadi belum di pakai,terimakasih shopee dan samsung..mudah²an barangnya awet di pakainya"
71446376021,https://shopee.co.id/Samsung-Galaxy-A07-4-64GB-Black-i.52635036.43962255887?extraParams=%7B%22display_model_id%22%3A301025014642%2C%22model_selection_logic%22%3A3%7D,myrnasarihamzah,5,Kondisi Barang: bagus | Keaslian: semoga ori awet | Kualitas: bagus semoga awet | Semoga awet buat orang tua pakai
73047979710,https://shopee.co.id/Samsung-Galaxy-A07-4-64GB-Black-i.52635036.43962255887?extraParams=%7B%22display_model_id%22%3A301025014642%2C%22model_selection_logic%22%3A3%7D,siti_aslamia,5,Kondisi Barang: baik | Fungsi: beroperasi sesuai harapan | Keaslian: asli | Alhmdulillah smpe juga udah 2x beli disni ori semoga tetep amanah
95804945907,https://shopee.co.id/Samsung-Galaxy-A07-4-64GB-Black-i.52635036.43962255887?extraParams=%7B%22display_model_id%22%3A301025014642%2C%22model_selection_logic%22%3A3%7D,suryanasuryana878,5,Kinerja: ponsel bekerja dengan baik | Kondisi: barang sudah diterima dengan baik dan sesuai dengan pesanan | Trimakasih buat toko nya sukses selalu respon cepat sesuai dengan pesanan barang mendarat dengan selamat makasih buat shopee pokoknya puas belanja di shopee sukses semuanya
81179538937,https://shopee.co.id/Samsung-Galaxy-A07-4-64GB-Black-i.52635036.43962255887?extraParams=%7B%22display_model_id%22%3A301025014642%2C%22model_selection_logic%22%3A3%7D,infcreativo,5,"Kondisi Barang: Bagus | Keaslian: Sesuai | Kinerja: Berfungsi dengan baik | Sangat rekomen belanja ditoko ini, packing nya aman sampai FLORES NTT dgn kondisi yang sangat baik"
97480597541,https://shopee.co.id/Samsung-Galaxy-A07-4-64GB-Black-i.52635036.43962255887?extraParams=%7B%22display_model_id%22%3A301025014642%2C%22model_selection_logic%22%3A3%7D,Anonim,5,"Kinerja: ponsel berfungsi dengan baik n bagus | Kondisi: barangnya utuh dan bersegel, walaupun di awal saya ragu soalnya sampai di saya kardus posisi agak terbuka dan tidak ada pengamannya"
75622919167,https://shopee.co.id/Samsung-Galaxy-A07-4-64GB-Black-i.52635036.43962255887?extraParams=%7B%22display_model_id%22%3A301025014642%2C%22model_selection_logic%22%3A3%7D,elnina1301,5,"Kondisi Barang: perfect | Kinerja: very good | Keaslian: pasti asli | Hp samsung nya bagus,sesuai pesanan,tidak ada komplain..pengiriman cepat banget,asli..sip sip okee"
73582302311,https://shopee.co.id/Samsung-Galaxy-A07-4-64GB-Black-i.52635036.43962255887?extraParams=%7B%22display_model_id%22%3A301025014642%2C%22model_selection_logic%22%3A3%7D,Anonim,5,Kondisi Barang: bagus dan mulus | Fungsi: berfungsi baik | Keaslian: asli jos gandos | Semoga mantap
74674094572,https://shopee.co.id/Samsung-Galaxy-A07-4-64GB-Black-i.52635036.43962255887?extraParams=%7B%22display_model_id%22%3A301025014642%2C%22model_selection_logic%22%3A3%7D,saiful_widianto,5,"Kondisi Barang: datang dalam keadaan mulus | Kinerja: berfungsi baik sesuai harapam | Keaslian: terjamin asli | Terima kasih banyak untuk toko sangat rekomended, barang kualitas samsung original"
99300242446,https://shopee.co.id/Samsung-Galaxy-A07-4-64GB-Black-i.52635036.43962255887?extraParams=%7B%22display_model_id%22%3A301025014642%2C%22model_selection_logic%22%3A3%7D,kanthiarum2110,5,Kinerja: hp berfungsi dengan baik tidak ada kendala | Kondisi: datang kondisi baru dan masih tersegel | Dengan harga murah bisa dpt hp spek bagus
77231566433,https://shopee.co.id/Samsung-Galaxy-A07-4-64GB-Black-i.52635036.43962255887?extraParams=%7B%22display_model_id%22%3A301025014642%2C%22model_selection_logic%22%3A3%7D,_sarah17hlc9,5,Fungsi: barang beroperasi dengan baik | Keaslian: terjamin asli | Kondisi Barang: datang dalam keadaan mulus
98883918992,https://shopee.co.id/Samsung-Galaxy-A07-4-64GB-Black-i.52635036.43962255887?extraParams=%7B%22display_model_id%22%3A301025014642%2C%22model_selection_logic%22%3A3%7D,kurniasinta_1996,5,"Kinerja: ponsel berfungsi lancar dan cocok untuk keseharian | Kondisi: ponsel datang dalam kondisi rapi dan baru | Recommended best seller pengiriman cepet banget hp mendarat dengan aman , digunakan juga enak pokoknya bagus banget terimakasih buat tokonya dan terimakasih buat kurirnya."
76439948270,https://shopee.co.id/Samsung-Galaxy-A07-4-64GB-Black-i.52635036.43962255887?extraParams=%7B%22display_model_id%22%3A301025014642%2C%22model_selection_logic%22%3A3%7D,nudinzainudin88,5,Kondisi Barang: aman sesuai iklan | Kinerja: baik | Keaslian: asli Samsung | Samsung black sesuai iklan mantap surantap jos gandos barangnya sesuai iklan nih mantap surantap jos gandos bisa langganan bos klo awet khusus nya Samsung mantap bos
73156166300,https://shopee.co.id/Samsung-Galaxy-A07-4-64GB-Black-i.52635036.43962255887?extraParams=%7B%22display_model_id%22%3A301025014642%2C%22model_selection_logic%22%3A3%7D,Anonim,5,Kondisi Barang: paket aman | Fungsi: lancar | Keaslian: ori dong
75437565977,https://shopee.co.id/Samsung-Galaxy-A07-4-64GB-Black-i.52635036.43962255887?extraParams=%7B%22display_model_id%22%3A301025014642%2C%22model_selection_logic%22%3A3%7D,Anonim,5,"Kondisi Barang: MULUS | Kinerja: BAIK | Fitur: BERGUNA | Barangnya ya pasti original dong, thanks ya seller."
72488201699,https://shopee.co.id/Samsung-Galaxy-A07-4-64GB-Black-i.52635036.43962255887?extraParams=%7B%22display_model_id%22%3A301025014642%2C%22model_selection_logic%22%3A3%7D,adityaarsyad725,5,"Kondisi Barang: ok | Fungsi: ok | Keaslian: ok | Toko amanah, kemasan aman 👍👍👍"
75336100655,https://shopee.co.id/Samsung-Galaxy-A07-4-64GB-Black-i.52635036.43962255887?extraParams=%7B%22display_model_id%22%3A301025014642%2C%22model_selection_logic%22%3A3%7D,salwanovita_17,5,"Wah gak nyangka sih aku seriusan, ini bikin degdeg an banget, maklum lah pengalaman pertama cek out gadget lewat online, tapi ternyata setelah barang nya sampe, hasil nya memuaskan banget, lebih puas daripada beli ke konter, sebelum cek out aku udah coba datengin beberapa konter hp di bec harga nya masih tinggi tinggi, tapi di sini aku bisa beli langsung dari official nya di tambah lagi sama harga nya lumayan murmer banget, thanks yh, seller, amanah, bisa di percaya, pengiriman nya aman tanpa penyok, cepet juga belum 2 hari udah sampe"
97088210772,https://shopee.co.id/Samsung-Galaxy-A07-4-64GB-Black-i.52635036.43962255887?extraParams=%7B%22display_model_id%22%3A301025014642%2C%22model_selection_logic%22%3A3%7D,Anonim,5,Kinerja: ok | Kondisi: ok | Alhamdulillah baru pertama x order hp online... Sesuai dngn ke inginan... Beli buat kado anak saya... Krna hp lama nya udh rusak total... Td udh survei ini hp cocok buat gaming roblox.... Terimakasih smoga sukses terus seller dn Shopee
76428958584,https://shopee.co.id/Samsung-Galaxy-A07-4-64GB-Black-i.52635036.43962255887?extraParams=%7B%22display_model_id%22%3A301025014642%2C%22model_selection_logic%22%3A3%7D,ciemlien,5,Kondisi Barang: datang keadaan kotak penyok robek | Kinerja: berfungsi dengan baik | Keaslian: ori | Barang datang kedaaan kerdus rada penyok ujung kardus robek takut banget kalo2 dituker kurir dan takut banget hp pecah karna kondisi kardus gitu tapi alhamdulilah aman semua hp nya bebrapa kali beli online baru kali ini dapet kardus penyok padahal dalem nya hp riskan banget ..
94420857933,https://shopee.co.id/Samsung-Galaxy-A07-4-64GB-Black-i.52635036.43962255887?extraParams=%7B%22display_model_id%22%3A301025014642%2C%22model_selection_logic%22%3A3%7D,Anonim,5,"Kinerja: semoga berfungsi dengan baik | Kondisi: datang dalam keadaan mulus | Kirain sudah free softcase ternyata harus klaim di Samsung gift, kondisi hp datang dalam kondisi baik."
83387765068,https://shopee.co.id/Samsung-Galaxy-A07-4-64GB-Black-i.52635036.43962255887?extraParams=%7B%22display_model_id%22%3A301025014642%2C%22model_selection_logic%22%3A3%7D,naddyariffda,5,Kondisi Barang: datang dalam keadaan masih rapih | Keaslian: sesuai foto | Kinerja: berfungsi dengan baik
76814582218,https://shopee.co.id/Samsung-Galaxy-A07-4-64GB-Black-i.52635036.43962255887?extraParams=%7B%22display_model_id%22%3A301025014642%2C%22model_selection_logic%22%3A3%7D,norizatilhasannah123,5,Kondisi Barang: datang dalam keadan mulus | Fungsi: berfungsi dengan baik | Keaslian: terjamin asli | Barang sdh sampai bagus real pic toko amanah nex time beli lagi di sini klo ada rezeki nya..
72198417394,https://shopee.co.id/Samsung-Galaxy-A07-4-64GB-Black-i.52635036.43962255887?extraParams=%7B%22display_model_id%22%3A301025014642%2C%22model_selection_logic%22%3A3%7D,Anonim,5,Kondisi Barang: ok | Fungsi: ok | Keaslian: original | Beli kedua kali nya dapat potongan 100ribu | Yang pertama buat anak yang ini juga buat anak | Harga terjangkau | Layar besar
77046393900,https://shopee.co.id/Samsung-Galaxy-A07-4-64GB-Black-i.52635036.43962255887?extraParams=%7B%22display_model_id%22%3A301025014642%2C%22model_selection_logic%22%3A3%7D,Anonim,5,Kondisi Barang: bagus effort banget | Fungsi: semoga beroperasi dengan baik dan awet🤲🤲 | Keaslian: terjamin asli gk nyesel beli disini | Sumpah awalnya sempet ragu tapi ternyata barang datang dengan cepat dan asli ori banget aku suka🥰🥰🥰
97324676025,https://shopee.co.id/Samsung-Galaxy-A07-4-64GB-Black-i.52635036.43962255887?extraParams=%7B%22display_model_id%22%3A301025014642%2C%22model_selection_logic%22%3A3%7D,Anonim,5,"Kinerja: ponsel berfungsi dengan baik | Kondisi: barang datang dengan kondisi mulus | Alhamdulillah...pesanan sudah di terima dengan baik,kualitas ori dan masih tersegel,semoga hapenya  awet,senang berbelanja di sini terima kasih😊"
77524916041,https://shopee.co.id/Samsung-Galaxy-A07-4-64GB-Black-i.52635036.43962255887?extraParams=%7B%22display_model_id%22%3A301025014642%2C%22model_selection_logic%22%3A3%7D,darkono89,5,Kondisi Barang: paket dalam keadaan rapi | Fungsi: berfungsi dengan baik | Keaslian: asli produk Samsung | Seller nya amanah
75539029888,https://shopee.co.id/Samsung-Galaxy-A07-4-64GB-Black-i.52635036.43962255887?extraParams=%7B%22display_model_id%22%3A301025014642%2C%22model_selection_logic%22%3A3%7D,streetsablon,5,Kondisi Barang: Baru | Kinerja: berfungsi baik | Keaslian: original samsung | Terima kasih...
95513360843,https://shopee.co.id/Samsung-Galaxy-A07-4-64GB-Black-i.52635036.43962255887?extraParams=%7B%22display_model_id%22%3A301025014642%2C%22model_selection_logic%22%3A3%7D,syarifhedayat,5,Kinerja: baik | Kondisi: mulus dan aman | Pengalaman kedua kali beli HP di Samsung via onlineshop dan alhamdulillah aman.packing rapi pakai buble warp.seller juga good respon.
76434058409,https://shopee.co.id/Samsung-Galaxy-A07-4-64GB-Black-i.52635036.43962255887?extraParams=%7B%22display_model_id%22%3A301025014642%2C%22model_selection_logic%22%3A3%7D,Anonim,5,Kondisi Barang: datang dalam keadaan mulus | Kinerja: berfungsi dengan baik dan sesuai harapan | Keaslian: terjamin asli
76336565563,https://shopee.co.id/Samsung-Galaxy-A07-4-64GB-Black-i.52635036.43962255887?extraParams=%7B%22display_model_id%22%3A301025014642%2C%22model_selection_logic%22%3A3%7D,chawett,5,Kondisi Barang: datang dalam keadaan mulus | Kinerja: berfungsi deangan baik | Keaslian: terjamin asli | mantaap
75538544814,https://shopee.co.id/Samsung-Galaxy-A07-4-64GB-Black-i.52635036.43962255887?extraParams=%7B%22display_model_id%22%3A301025014642%2C%22model_selection_logic%22%3A3%7D,jivita22,4,"Kondisi Barang: baik | Kinerja: berfungsi dengan baik | Keaslian: asli | Sebelumnya sempat chat dgn samsung officialnya lsg, packing bilangnya sesuai standar samsung. Sepertinya packing aku ini kurang dari standar deh, bubble wrap nya ga presisi sm kotak hp nya. Udh itu dipengiriman bisa berhari2 dipalembang, kenapa lama sekali. Sedikit kecewa tapi ya sudah lah ya... video unboxing ga bisa kekirim"
96265698719,https://shopee.co.id/Samsung-Galaxy-A07-4-64GB-Black-i.52635036.43962255887?extraParams=%7B%22display_model_id%22%3A301025014642%2C%22model_selection_logic%22%3A3%7D,linggapriani,5,Kondisi: masih dalam keadaan di segel dan bagus tanpa lecet sedikitpun
75238719363,https://shopee.co.id/Samsung-Galaxy-A07-4-64GB-Black-i.52635036.43962255887?extraParams=%7B%22display_model_id%22%3A301025014642%2C%22model_selection_logic%22%3A3%7D,atosupriadi,5,"sudah diterima,gak bakalan kecewa beli produk - produk dari samsung,,selalu cakep.."
97688234872,https://shopee.co.id/Samsung-Galaxy-A07-4-64GB-Black-i.52635036.43962255887?extraParams=%7B%22display_model_id%22%3A301025014642%2C%22model_selection_logic%22%3A3%7D,nono_taryono2019,5,Kinerja: HP diterima dalam kondisi baik | Kondisi: HP mulus | HPnya diterima dengan mulus | Semoga awet
97413511862,https://shopee.co.id/Samsung-Galaxy-A07-4-64GB-Black-i.52635036.43962255887?extraParams=%7B%22display_model_id%22%3A301025014642%2C%22model_selection_logic%22%3A3%7D,Anonim,5,"Kinerja: baik | Kondisi: baik | Terima kasih paket audah datang sesuai pesanan,Alhamdulillah sangat puas. Samsung selalu ok sih, Semoga bisa awet , sukses selalu"
