id_komentar,produk_url,username,rating,ulasan
100719703476,https://shopee.co.id/Samsung-Galaxy-A07-4-64GB-Light-Violet-i.52635036.26639691370?extraParams=%7B%22display_model_id%22%3A266025631835%2C%22model_selection_logic%22%3A3%7D,Anonim,3,Sim card nya susah di buka
93907561821,https://shopee.co.id/Samsung-Galaxy-A07-4-64GB-Light-Violet-i.52635036.26639691370?extraParams=%7B%22display_model_id%22%3A266025631835%2C%22model_selection_logic%22%3A3%7D,jakahendro,3,Sangat memuaskan
101243429759,https://shopee.co.id/Samsung-Galaxy-A07-4-64GB-Light-Violet-i.52635036.26639691370?extraParams=%7B%22display_model_id%22%3A266025631835%2C%22model_selection_logic%22%3A3%7D,Anonim,3,"hei samsung official, hpnya si sesuai harga. | tapi kok katanya gratis casing mna? | terus knp buat masukin sim cardnya mleyot? | saran gausah beli, mending tabung dulu buat beli hp yang 2 jutaan juga udah lebih mantep speknya"
99108249066,https://shopee.co.id/Samsung-Galaxy-A07-4-64GB-Light-Violet-i.52635036.26639691370?extraParams=%7B%22display_model_id%22%3A266025631835%2C%22model_selection_logic%22%3A3%7D,Anonim,3,Membantu?
101190348376,https://shopee.co.id/Samsung-Galaxy-A07-4-64GB-Light-Violet-i.52635036.26639691370?extraParams=%7B%22display_model_id%22%3A266025631835%2C%22model_selection_logic%22%3A3%7D,Anonim,3,Membantu?
96426413230,https://shopee.co.id/Samsung-Galaxy-A07-4-64GB-Light-Violet-i.52635036.26639691370?extraParams=%7B%22display_model_id%22%3A266025631835%2C%22model_selection_logic%22%3A3%7D,nurekolestari,3,Membantu?
82487501361,https://shopee.co.id/Samsung-Galaxy-A07-4-64GB-Light-Violet-i.52635036.26639691370?extraParams=%7B%22display_model_id%22%3A266025631835%2C%22model_selection_logic%22%3A3%7D,nurul_aulia100,3,Membantu?
85067967218,https://shopee.co.id/Samsung-Galaxy-A07-4-64GB-Light-Violet-i.52635036.26639691370?extraParams=%7B%22display_model_id%22%3A266025631835%2C%22model_selection_logic%22%3A3%7D,mustika.sabila,3,Membantu?
89346414080,https://shopee.co.id/Samsung-Galaxy-A07-4-64GB-Light-Violet-i.52635036.26639691370?extraParams=%7B%22display_model_id%22%3A266025631835%2C%22model_selection_logic%22%3A3%7D,salwaalika,3,Membantu?
100203218741,https://shopee.co.id/Samsung-Galaxy-A07-4-64GB-Light-Violet-i.52635036.26639691370?extraParams=%7B%22display_model_id%22%3A266025631835%2C%22model_selection_logic%22%3A3%7D,Anonim,3,Membantu?
100429415543,https://shopee.co.id/Samsung-Galaxy-A07-4-64GB-Light-Violet-i.52635036.26639691370?extraParams=%7B%22display_model_id%22%3A266025631835%2C%22model_selection_logic%22%3A3%7D,tesapratiwi13,3,Membantu?
97597361310,https://shopee.co.id/Samsung-Galaxy-A07-4-64GB-Light-Violet-i.52635036.26639691370?extraParams=%7B%22display_model_id%22%3A266025631835%2C%22model_selection_logic%22%3A3%7D,amirabilqish,3,Membantu?
78698671740,https://shopee.co.id/Samsung-Galaxy-A07-4-64GB-Light-Violet-i.52635036.26639691370?extraParams=%7B%22display_model_id%22%3A266025631835%2C%22model_selection_logic%22%3A3%7D,apriliansyahm941998,3,Membantu?
94953219631,https://shopee.co.id/Samsung-Galaxy-A07-4-64GB-Light-Violet-i.52635036.26639691370?extraParams=%7B%22display_model_id%22%3A266025631835%2C%22model_selection_logic%22%3A3%7D,Anonim,3,Membantu?
85547306626,https://shopee.co.id/Samsung-Galaxy-A07-4-64GB-Light-Violet-i.52635036.26639691370?extraParams=%7B%22display_model_id%22%3A266025631835%2C%22model_selection_logic%22%3A3%7D,_pfzo821wp,3,Membantu?
89984248560,https://shopee.co.id/Samsung-Galaxy-A07-4-64GB-Light-Violet-i.52635036.26639691370?extraParams=%7B%22display_model_id%22%3A266025631835%2C%22model_selection_logic%22%3A3%7D,mamatrruhiman,3,Membantu?
70057676983,https://shopee.co.id/Samsung-Galaxy-A07-4-64GB-Light-Violet-i.52635036.26639691370?extraParams=%7B%22display_model_id%22%3A266025631835%2C%22model_selection_logic%22%3A3%7D,redsgamer,4,Fungsi: berfungsi dengan baik | Keaslian: terjamin keaslian nya | Kondisi: produk diterima dengan baik | Bonus SIM card + kuota data tidak ada😭
83598081420,https://shopee.co.id/Samsung-Galaxy-A07-4-64GB-Light-Violet-i.52635036.26639691370?extraParams=%7B%22display_model_id%22%3A266025631835%2C%22model_selection_logic%22%3A3%7D,Anonim,4,"Kondisi Barang: Mulus | Keaslian: Original | Fungsi: Komunikasi | Beli hp online di official samsung, insha Allah original & terdaftar IMEI serta kelengkapan produk lengkap. Produk berfungsi dengan baik 👍🏻"
95083591763,https://shopee.co.id/Samsung-Galaxy-A07-4-64GB-Light-Violet-i.52635036.26639691370?extraParams=%7B%22display_model_id%22%3A266025631835%2C%22model_selection_logic%22%3A3%7D,aakdimas683,4,"Fungsi: ponsel berfungsi dengan baik | Daya tahan: baterai awet karna masih baru | Alhamdulillah barang datang dengan selamat dan gak cacat meskipun pengiriman jauh dari jakarta ke surabaya gak cacat sama sekali kardusnya warna juga bagus hp layarnya juga lebar gak kecil ,pengiriman cepat penjual responnya baik ,hpnya normal gak ada kerusakan sudah di coba ,ya bersyukur banget sih"
71100880342,https://shopee.co.id/Samsung-Galaxy-A07-4-64GB-Light-Violet-i.52635036.26639691370?extraParams=%7B%22display_model_id%22%3A266025631835%2C%22model_selection_logic%22%3A3%7D,darin.collection165,4,"Sepadan dengan Harga: wort it | Fitur Terbaik: ok | Cuma di deskripsi nya dapet kartu kuota xl ini ga ada ,next time jgn bilang ada klo tidak ada 🤭"
76326404993,https://shopee.co.id/Samsung-Galaxy-A07-4-64GB-Light-Violet-i.52635036.26639691370?extraParams=%7B%22display_model_id%22%3A266025631835%2C%22model_selection_logic%22%3A3%7D,alifhafizhmusyafa,4,"Kondisi Barang: datang dengan mulus dan sesuai tanpa ada yg kurang | Fungsi: berfungsi dengan baik | Keaslian: insyaallah ori | Alhamdulillah udah mendarat dengan baik dan cepat,,"
75228940285,https://shopee.co.id/Samsung-Galaxy-A07-4-64GB-Light-Violet-i.52635036.26639691370?extraParams=%7B%22display_model_id%22%3A266025631835%2C%22model_selection_logic%22%3A3%7D,exx779,4,Kondisi Barang: nyala | Fungsi: berfungsi dngan baik | Keaslian: asli | Packing kurang aman | Saat datang kardus sudah sobek
84545966260,https://shopee.co.id/Samsung-Galaxy-A07-4-64GB-Light-Violet-i.52635036.26639691370?extraParams=%7B%22display_model_id%22%3A266025631835%2C%22model_selection_logic%22%3A3%7D,Anonim,4,Kondisi Barang: datang sesuai keinginan barang mulus | Keaslian: ori | Fungsi: beroperasi dgn baik
89119708681,https://shopee.co.id/Samsung-Galaxy-A07-4-64GB-Light-Violet-i.52635036.26639691370?extraParams=%7B%22display_model_id%22%3A266025631835%2C%22model_selection_logic%22%3A3%7D,era.yani31,4,Fungsi: berfungsi | Daya tahan: mudahan awet | Bagus ya ...Dari segi packaging nya oke. Hp nya mulus GK ad lecet sdkitpun. Hpnya berfungsi stlh di hidupkan. Semoga awet... recommend beli dsni .
93895480757,https://shopee.co.id/Samsung-Galaxy-A07-4-64GB-Light-Violet-i.52635036.26639691370?extraParams=%7B%22display_model_id%22%3A266025631835%2C%22model_selection_logic%22%3A3%7D,saepulkarhi,4,Fungsi: Ponsel berfungsi baik dan sesuai harapan saya | Daya tahan: Baterai ponsel ini lumayan awet meski belum diuji maksimal | Barang baru mungkin bisa membuat bahagia bagi yang mendapatkannya demikian halnya dengan sebuah telepon genggam yang dari waktu ke waktu selalu dalam genggaman. A07 tentu saja lebih baik dari pendahulunya atau hp lama pemiliknya.
94978225369,https://shopee.co.id/Samsung-Galaxy-A07-4-64GB-Light-Violet-i.52635036.26639691370?extraParams=%7B%22display_model_id%22%3A266025631835%2C%22model_selection_logic%22%3A3%7D,Anonim,4,Fungsi: normal | Daya tahan: lumayan | Minusnya kita sudah bayar extra packing agar lebih aman ternyata hanya sebuah kerdus yang ukuranya lebih besar dari barangnya dan di dalamnya hanya ada Babel tipis untuk membungkus si produknya itu
97158775642,https://shopee.co.id/Samsung-Galaxy-A07-4-64GB-Light-Violet-i.52635036.26639691370?extraParams=%7B%22display_model_id%22%3A266025631835%2C%22model_selection_logic%22%3A3%7D,Anonim,4,"Fungsi: Semua bagus | Daya tahan: Belum dicoba | Iya sih samsung 1 jutaan, tapi packaging pengiriman nya ga banget, bubble wrap selembar doang + kardus."
76795109679,https://shopee.co.id/Samsung-Galaxy-A07-4-64GB-Light-Violet-i.52635036.26639691370?extraParams=%7B%22display_model_id%22%3A266025631835%2C%22model_selection_logic%22%3A3%7D,Anonim,4,"Kondisi Barang: baik | Fungsi: komunikasi | Keaslian: ori | Meskipun satu pulau tp lamaa tgl estimasi jg lewat ternyata gk menjamin nyampenya cepet,paketnya sdh smpe tp dusnya memprihantinkan untung isinya gk p'pa"
75571588865,https://shopee.co.id/Samsung-Galaxy-A07-4-64GB-Light-Violet-i.52635036.26639691370?extraParams=%7B%22display_model_id%22%3A266025631835%2C%22model_selection_logic%22%3A3%7D,rizky4ntik,4,Barang sampai dengan aman dan asli. Lebih baik lagi bubblewrapnya ditambah agak lebih tebal
88926784117,https://shopee.co.id/Samsung-Galaxy-A07-4-64GB-Light-Violet-i.52635036.26639691370?extraParams=%7B%22display_model_id%22%3A266025631835%2C%22model_selection_logic%22%3A3%7D,saaaaaaaa08,4,"Kondisi Barang: mulus sih | Keaslian: dari official harusnya ori ya | Fungsi: belum di coba tp semoga awet kaya samsung yang lain, warnanya violet tp ilusi kaya silver tp bagusss"
97512522535,https://shopee.co.id/Samsung-Galaxy-A07-4-64GB-Light-Violet-i.52635036.26639691370?extraParams=%7B%22display_model_id%22%3A266025631835%2C%22model_selection_logic%22%3A3%7D,Anonim,4,"Fungsi: kesing hp ny ga ada | Untung aja | Ga kenapa2 hp nya. Ya allah… org beli lohh pke duitt, knp hny sehelai aja balutnya, astaga memanglah samsung ni, aku beli hp smsung ini krn brmerek, tp kayak gtu ya!!!!!"
100541122291,https://shopee.co.id/Samsung-Galaxy-A07-4-64GB-Light-Violet-i.52635036.26639691370?extraParams=%7B%22display_model_id%22%3A266025631835%2C%22model_selection_logic%22%3A3%7D,tantitritama401,4,"Daya tahan: semoga awet, biasanya pelanggan samsung akan kehilangan sinyal setelah lama pemakaian dan lcd sering rusak | Katanya free case, pas brg sampai ga ada casenya..."
72468256786,https://shopee.co.id/Samsung-Galaxy-A07-4-64GB-Light-Violet-i.52635036.26639691370?extraParams=%7B%22display_model_id%22%3A266025631835%2C%22model_selection_logic%22%3A3%7D,Anonim,4,0:07
95428949742,https://shopee.co.id/Samsung-Galaxy-A07-4-64GB-Light-Violet-i.52635036.26639691370?extraParams=%7B%22display_model_id%22%3A266025631835%2C%22model_selection_logic%22%3A3%7D,hendrischurrle,4,Fungsi: ponsel bagus | Daya tahan: baterai tahan lama
95283033562,https://shopee.co.id/Samsung-Galaxy-A07-4-64GB-Light-Violet-i.52635036.26639691370?extraParams=%7B%22display_model_id%22%3A266025631835%2C%22model_selection_logic%22%3A3%7D,48yjuuqdwt,4,Fungsi: semoga bagus | Daya tahan: semoga awet
88427629375,https://shopee.co.id/Samsung-Galaxy-A07-4-64GB-Light-Violet-i.52635036.26639691370?extraParams=%7B%22display_model_id%22%3A266025631835%2C%22model_selection_logic%22%3A3%7D,Anonim,4,Pengiriman lama dan kardusnya penyok
95644216935,https://shopee.co.id/Samsung-Galaxy-A07-4-64GB-Light-Violet-i.52635036.26639691370?extraParams=%7B%22display_model_id%22%3A266025631835%2C%22model_selection_logic%22%3A3%7D,yudhie_cozy,4,Fungsi: ponsel berfungsi mudah2an awet | Daya tahan: pengisian batrai kencang mugi2 tahan
99472497891,https://shopee.co.id/Samsung-Galaxy-A07-4-64GB-Light-Violet-i.52635036.26639691370?extraParams=%7B%22display_model_id%22%3A266025631835%2C%22model_selection_logic%22%3A3%7D,Anonim,4,"Pesanan sy terima, terimakasih seller.bsemuanya bagus"
82243351070,https://shopee.co.id/Samsung-Galaxy-A07-4-64GB-Light-Violet-i.52635036.26639691370?extraParams=%7B%22display_model_id%22%3A266025631835%2C%22model_selection_logic%22%3A3%7D,aziza2412,4,Kondisi Barang: baguss | Keaslian: bagus | Fungsi: baagus | Cmn sayang bngt udh lebihin 40rb cmn biar safety ttpi engga bngt tipis poll klo di banting pecah dahh tuh
81371103428,https://shopee.co.id/Samsung-Galaxy-A07-4-64GB-Light-Violet-i.52635036.26639691370?extraParams=%7B%22display_model_id%22%3A266025631835%2C%22model_selection_logic%22%3A3%7D,srinita20,4,0:10
70688663299,https://shopee.co.id/Samsung-Galaxy-A07-4-64GB-Light-Violet-i.52635036.26639691370?extraParams=%7B%22display_model_id%22%3A266025631835%2C%22model_selection_logic%22%3A3%7D,alonedstr26,5,"Fungsi: Normal | Keaslian: Ori | Kondisi: Baik | Asik Samsung udah bisa bersaing dengan brand China secara spek di segmen entry level, yang bikin kepincut sih gara2 jaminan update Android 6x di entry level gaada lawan wkwk, udah gitu speknya emang sesuai kebutuhan sih 4/64 masih cukup sama saya, dan Helio G99 performa udah oke cuma buat sosmed dan WA serta browsing2, kalau untuk multimedia dan fotografi saya masih nyimpen Pixel 3 buat hp kedua soalnya"
71516108690,https://shopee.co.id/Samsung-Galaxy-A07-4-64GB-Light-Violet-i.52635036.26639691370?extraParams=%7B%22display_model_id%22%3A266025631835%2C%22model_selection_logic%22%3A3%7D,Anonim,5,"Fungsi: Bagus, mantap! | Keaslian: Orisional | Kondisi: Diterima baik | Amazing bgt, pesen kamis , jumat sudah datang. | Terimakasih seller, kurir, dll yg sudah gercep sekali. | Senang , dan puas krn emg lgi urgen banget .. 🥰💯"
72568325406,https://shopee.co.id/Samsung-Galaxy-A07-4-64GB-Light-Violet-i.52635036.26639691370?extraParams=%7B%22display_model_id%22%3A266025631835%2C%22model_selection_logic%22%3A3%7D,burhanzipro,5,"Fungsi: sesuai harapan | Kondisi Barang: segel dan mulus | Keaslian: asli | Ponsel ini khusus untuk medsos dan mobile banking, karena jaminan update dan security updatenya 6 tahun. Semoga hapenya bisa awet bahkan lewat jaminan updatenya. Pertimbangan saya ambil ponsel ini terlepas dari RAM 4 dan Internal hanya 64 GB karena jaminan update lama software lama, processor,  dan tipe internal memorynya yang sudah UFS. Layarnya juga lumayan smooth. Jika punya budget lebih lagi insyaallah mau beli tablet sebagai pendampingnya. Jadi fungsi untuk entertainment dan produktivitas bisa via tablet."
69645063374,https://shopee.co.id/Samsung-Galaxy-A07-4-64GB-Light-Violet-i.52635036.26639691370?extraParams=%7B%22display_model_id%22%3A266025631835%2C%22model_selection_logic%22%3A3%7D,arin.anam13,5,Barangnya oke aman gak ada lecet sama sekali. Hp nya juga menyala dan berfungsi dengan baik
71508701014,https://shopee.co.id/Samsung-Galaxy-A07-4-64GB-Light-Violet-i.52635036.26639691370?extraParams=%7B%22display_model_id%22%3A266025631835%2C%22model_selection_logic%22%3A3%7D,Anonim,5,"Fungsi: beroperasi dengan baik | Keaslian: terjamin ori | Kondisi: kondisi baik | Alhamdulillah barang nya sdh smpai, hpny ringan nyaman digenggam, smga awet trmksh seller 🙏🏻"
75376435653,https://shopee.co.id/Samsung-Galaxy-A07-4-64GB-Light-Violet-i.52635036.26639691370?extraParams=%7B%22display_model_id%22%3A266025631835%2C%22model_selection_logic%22%3A3%7D,Anonim,5,"Mencoba beli Samsung ini bukan untuk daily driver tapi tetap lumayan bagus meski di harga murah. Bisa mencicipi OneUI terbaru. Hpnya sangat ringan, layar besar, body kerasa banget terbuat dari plastik dan back cover ketika ditekan ada ruang kosong. Meskipun begitu tetap nyaman dipakai. Baterai lumayan awet tapi sayangnya pengujian ketahanan baterai tidak dilakukan dengan layak karena hanya digunakan untuk scroll dan pekerjaan ringan lainnya, tidak diuji game, sosial media, dll"
75567437201,https://shopee.co.id/Samsung-Galaxy-A07-4-64GB-Light-Violet-i.52635036.26639691370?extraParams=%7B%22display_model_id%22%3A266025631835%2C%22model_selection_logic%22%3A3%7D,sshhyynn,5,"Alhamdulillah bisa beli hp pakai uang hasil kerja sendiri, untuk pertama kalinya beli hp online ternyata aman, semoga hpnya awet. | Bagus banget hpnya, warna light purple cantik banget sumpah, suka banget pokoknya. | Love sekebon buat Samsung"
72199693584,https://shopee.co.id/Samsung-Galaxy-A07-4-64GB-Light-Violet-i.52635036.26639691370?extraParams=%7B%22display_model_id%22%3A266025631835%2C%22model_selection_logic%22%3A3%7D,Anonim,5,"Fungsi: HP berfungsi dengan baik | Kondisi Barang: datang dalam keamanan mulus | Keaslian: terjamin asli | hp berfungsi dengan baik, semoga awet pemaikaian"
71698934596,https://shopee.co.id/Samsung-Galaxy-A07-4-64GB-Light-Violet-i.52635036.26639691370?extraParams=%7B%22display_model_id%22%3A266025631835%2C%22model_selection_logic%22%3A3%7D,bungacahyasri,5,Fungsi: handphone beroperasi dengan baik | Keaslian: terjamin asli | Kondisi: produk diterima dengan baik | alhamdulillah sampai nya cepat
71081166792,https://shopee.co.id/Samsung-Galaxy-A07-4-64GB-Light-Violet-i.52635036.26639691370?extraParams=%7B%22display_model_id%22%3A266025631835%2C%22model_selection_logic%22%3A3%7D,Anonim,5,Fungsi: ok | Keaslian: ok | Kondisi: ok | Pengemasan cepat | Sehari sampai | Buat anak cocok layar besar | Ringan harga terjangkau | Semoga awet
75241473798,https://shopee.co.id/Samsung-Galaxy-A07-4-64GB-Light-Violet-i.52635036.26639691370?extraParams=%7B%22display_model_id%22%3A266025631835%2C%22model_selection_logic%22%3A3%7D,nenghaniaa,5,"Kondisi Barang: aman | Sempet takut beli online, takut diperjalanan ada oknum nakal, tapi ternyata aman ya guys, packing nya juga ga ada yg terbuka | Jangan ragu beli disini✨"
71230566218,https://shopee.co.id/Samsung-Galaxy-A07-4-64GB-Light-Violet-i.52635036.26639691370?extraParams=%7B%22display_model_id%22%3A266025631835%2C%22model_selection_logic%22%3A3%7D,Anonim,5,"Fitur Terbaik: semua fitur nya bagus | Sepadan dengan Harga: sebanding dengan harga | Hp nya keren dan mantap, serta canggih punya"
71519057718,https://shopee.co.id/Samsung-Galaxy-A07-4-64GB-Light-Violet-i.52635036.26639691370?extraParams=%7B%22display_model_id%22%3A266025631835%2C%22model_selection_logic%22%3A3%7D,Anonim,5,"Fungsi: beroperasi dengan baik | Keaslian: original | Kondisi: barang diterima dengan baik | Alhamdulilah pesanan mendarat dengan aman, tanpa ada yang kurang, kameranya bagus seperti foto yang saya upload, yang paling saya suka dari produk ini memiliki suara audio yang sangat jelas..."
70685749069,https://shopee.co.id/Samsung-Galaxy-A07-4-64GB-Light-Violet-i.52635036.26639691370?extraParams=%7B%22display_model_id%22%3A266025631835%2C%22model_selection_logic%22%3A3%7D,Anonim,5,Fungsi: Handpond beroprasi dengan baik | Keaslian: terjamin asli | Kondisi: produk diterima dengan baik | pengiriman aman dan cepet | barang juga ori | terimakasih seller
71838788438,https://shopee.co.id/Samsung-Galaxy-A07-4-64GB-Light-Violet-i.52635036.26639691370?extraParams=%7B%22display_model_id%22%3A266025631835%2C%22model_selection_logic%22%3A3%7D,titi_dmy_20,5,Fungsi: HP beroperasi dengan baik sesuai deskripsi | Keaslian: terjamin asli | Kondisi: produk diterima dengan baik
78725445466,https://shopee.co.id/Samsung-Galaxy-A07-4-64GB-Light-Violet-i.52635036.26639691370?extraParams=%7B%22display_model_id%22%3A266025631835%2C%22model_selection_logic%22%3A3%7D,sutinah2602,5,"Kondisi Barang: Lumayan anu | Fungsi: Berfungsu | Keaslian: Original | Keadaan pas datang kardus terbuka sampai terlihat isinya , semoga kedepannya bisa ditingkatkan. Untuk barang berfungsi dengan baik , pengiriman lumayan cepat. Terimakasih Samsung Indonesia!"
71794508349,https://shopee.co.id/Samsung-Galaxy-A07-4-64GB-Light-Violet-i.52635036.26639691370?extraParams=%7B%22display_model_id%22%3A266025631835%2C%22model_selection_logic%22%3A3%7D,wolosupriyono,5,Fungsi: normal smp dengan hari ini | Keaslian: SEIN | Kondisi: mulus terpacking dgan baik | Pesanan diterima fengan baik..produk sesuai dengam deskripsi.. packing sman dan rapi. Keceoatan kirim jg sangat cepat..bonus adaptor | Yerimakadih seler dsn naskurir nya
84551317455,https://shopee.co.id/Samsung-Galaxy-A07-4-64GB-Light-Violet-i.52635036.26639691370?extraParams=%7B%22display_model_id%22%3A266025631835%2C%22model_selection_logic%22%3A3%7D,fitriyanisd88,5,"Fungsi: good | Daya tahan: good | Jangan ragu di sini ori,, uda cek IMEI  ok, semua uda di tes ok. Pengiriman good cuuuepeeeet bgt hari ini pesan besok datang good job | Kameranya sama2 8 yg selfie dgn hp aq yg ini lebih mulus ini kalo di filter nya kalo natural nya  tanpa filter lebih jelas a07,,, kamera belakang jg sm sm ini 50 lebih tajam a07 lebih warna nya tajam natural"
72574477355,https://shopee.co.id/Samsung-Galaxy-A07-4-64GB-Light-Violet-i.52635036.26639691370?extraParams=%7B%22display_model_id%22%3A266025631835%2C%22model_selection_logic%22%3A3%7D,dharmawanm,5,"Fungsi: Berfungsi dengan Baik | Kondisi Barang: 100% mulus dan baru | Keaslian: Sangat Asli, Original from Samsung Official Store | Semoga awet dan dapat berfungsi dengan baik, mantap Samsung"
96202931998,https://shopee.co.id/Samsung-Galaxy-A07-4-64GB-Light-Violet-i.52635036.26639691370?extraParams=%7B%22display_model_id%22%3A266025631835%2C%22model_selection_logic%22%3A3%7D,nd198mr4cy,5,"Fungsi: ponsel berfungsi baik dan sesuai harapan | Daya tahan: awet dan tahan lama | bagus sesuai foto, tipis ringann aesthetic bangeeeet pokoknyaaaaa🥰🥰🥰"
71444133826,https://shopee.co.id/Samsung-Galaxy-A07-4-64GB-Light-Violet-i.52635036.26639691370?extraParams=%7B%22display_model_id%22%3A266025631835%2C%22model_selection_logic%22%3A3%7D,Anonim,5,"Sesuai pesanan, berfungsi dengan baik. Semoga awet. Terima kasih"
73217828930,https://shopee.co.id/Samsung-Galaxy-A07-4-64GB-Light-Violet-i.52635036.26639691370?extraParams=%7B%22display_model_id%22%3A266025631835%2C%22model_selection_logic%22%3A3%7D,Anonim,5,Kondisi Barang: bagus | Fungsi: sesuai harapan | Keaslian: asli original | Mkasih next order lagi
79390663751,https://shopee.co.id/Samsung-Galaxy-A07-4-64GB-Light-Violet-i.52635036.26639691370?extraParams=%7B%22display_model_id%22%3A266025631835%2C%22model_selection_logic%22%3A3%7D,Anonim,5,Kondisi Barang: baik | Keaslian: original | Fungsi: berpungsi dan kondisi baik | Batang lengkap semua dan hp ny diterima dalam kondisi baik
97013218601,https://shopee.co.id/Samsung-Galaxy-A07-4-64GB-Light-Violet-i.52635036.26639691370?extraParams=%7B%22display_model_id%22%3A266025631835%2C%22model_selection_logic%22%3A3%7D,Anonim,5,Fungsi: berfungsi dengan baik | Daya tahan: lumayan awet | pengirimannyaa cepet dan alhamdulillah dpt kurir yg amanah. barangnyaa juga sampai dengan aman. speknyaa oke kok untuk harga segini. aman ajaa
71086017881,https://shopee.co.id/Samsung-Galaxy-A07-4-64GB-Black-i.52635036.43962255887?extraParams=%7B%22display_model_id%22%3A301025014642%2C%22model_selection_logic%22%3A3%7D,bogell_001,5,"Kondisi Barang: ori masih segel | paket mendarat dengan selamat bner"" ori masih di segel seler nyy jga ramah mantul deh pokonya terimaksih semoga tokonya makin sukses trus"
70993503252,https://shopee.co.id/Samsung-Galaxy-A07-4-64GB-Black-i.52635036.43962255887?extraParams=%7B%22display_model_id%22%3A301025014642%2C%22model_selection_logic%22%3A3%7D,Anonim,5,"Kondisi Barang: datang dalam keadaan mulus | Keaslian: terjamin asli | Kualitas: sangat bagus dan memuaskan | Alhamdulillah barang sudah sampai sesuai pesanan,terjamin keaslianya,dan berfungsi dengan baik.mudah mudahan awet. | Amanah buat tokonya"
69638439454,https://shopee.co.id/Samsung-Galaxy-A07-4-64GB-Black-i.52635036.43962255887?extraParams=%7B%22display_model_id%22%3A301025014642%2C%22model_selection_logic%22%3A3%7D,yurnaliza_1,5,Mantap sesuai pesanan packing amat samgat safety toko amanah jangan takut ngorder gengss
71087427366,https://shopee.co.id/Samsung-Galaxy-A07-4-64GB-Black-i.52635036.43962255887?extraParams=%7B%22display_model_id%22%3A301025014642%2C%22model_selection_logic%22%3A3%7D,Anonim,5,"Kondisi Barang: terbungkus dgn rapi | Keaslian: smoga asli | Kualitas: sangat bagus | Udh kali kedua beli di toko ini, yg pertama msh bs dipake 5 thn an. Pesen siang, sore udh sampai. Kurir amanah. Tengkyuuu"
69942691430,https://shopee.co.id/Samsung-Galaxy-A07-4-64GB-Black-i.52635036.43962255887?extraParams=%7B%22display_model_id%22%3A301025014642%2C%22model_selection_logic%22%3A3%7D,reviseptianii,5,"Kondisi Barang: barang mulus | Keaslian: dijamin ori | Kualitas: kualitas bagus | beliin hp buat papah, untuk harga segini udah bagus bgt kualitas nya🔥🔥"
73781891917,https://shopee.co.id/Samsung-Galaxy-A07-4-64GB-Black-i.52635036.43962255887?extraParams=%7B%22display_model_id%22%3A301025014642%2C%22model_selection_logic%22%3A3%7D,goodtheday,5,"Kondisi Barang: mulus | Fungsi: normal,baik | Keaslian: asli | 4/64 masih baiklah sesuai dengan harga, isi dus : hp, kabel C to C, ejector, panduan + ada chargernya di luar. sayang tidak dapat perdananya mungkin kehabisan. sudah dicoba beberapa hari lancar tanpa kendala"
73037438521,https://shopee.co.id/Samsung-Galaxy-A07-4-64GB-Black-i.52635036.43962255887?extraParams=%7B%22display_model_id%22%3A301025014642%2C%22model_selection_logic%22%3A3%7D,dederishadi7,5,"Kondisi Barang: datang dalam keadaan mulus | Fungsi: barang beroperasi sesuai harapan | Keaslian: terjamin asli mall ori | Paket mendarat dengan selamat,pengiriman sat set barang sesuai pesanan,terima kasih sukses selalu"
70276801923,https://shopee.co.id/Samsung-Galaxy-A07-4-64GB-Black-i.52635036.43962255887?extraParams=%7B%22display_model_id%22%3A301025014642%2C%22model_selection_logic%22%3A3%7D,azri737,5,"Kondisi Barang: baik banget | Keaslian: 💯 | Kualitas: ori | Pengiriman cepet, peking ok, barang sesuai"
85382418184,https://shopee.co.id/Samsung-Galaxy-A07-4-64GB-Black-i.52635036.43962255887?extraParams=%7B%22display_model_id%22%3A301025014642%2C%22model_selection_logic%22%3A3%7D,Anonim,5,Kondisi Barang: Baik dan bagus | Keaslian: Original samsung | Fungsi: Bekerja dengan baik dan normal | Penjual sangatlah responsif dan gercep
72864971698,https://shopee.co.id/Samsung-Galaxy-A07-4-64GB-Black-i.52635036.43962255887?extraParams=%7B%22display_model_id%22%3A301025014642%2C%22model_selection_logic%22%3A3%7D,bastomipml,5,Kondisi Barang: bagus dan resmi segel samsung | Fungsi: normal dan sesuai | Keaslian: original Samsung
